creado,texto_es,texto_en,polaridad,valor_polaridad,ubicacion_usuario,terminos_2, terminos_3
2019-08-22 03:06:38,disculp sr. alcalde c escucha entr pasillos d la alcald칤a etapa y dm치s instituciones municipales q c est치 sacando exceso d personal q m parece correcto. pero c deber칤a no contratar m치s gent o si no d q ahorro hablamos. gracias por la aclaraci칩n.,excuse me mr mayor c listen in the hallways d the mayor stage and dms municipal institutions q c is removing excess d staff q m seems correct but c should not hire more people or if not d q savings we talk thank you for the clarification,positivo,0.225,Cuenca Ecuador,disculp_sr sr_alcalde alcalde_c c_escucha escucha_entr entr_pasillos pasillos_d d_la la_alcalda alcalda_etapa etapa_y y_dms dms_instituciones instituciones_municipales municipales_q q_c c_est est_sacando sacando_exceso exceso_d d_personal personal_q q_m m_parece parece_correcto correcto_pero pero_c c_debera debera_no no_contratar contratar_ms ms_gent gent_o o_si si_no no_d d_q q_ahorro ahorro_hablamos hablamos_gracias gracias_por por_la la_aclaracin,disculp_sr_alcalde sr_alcalde_c alcalde_c_escucha c_escucha_entr escucha_entr_pasillos entr_pasillos_d pasillos_d_la d_la_alcalda la_alcalda_etapa alcalda_etapa_y etapa_y_dms y_dms_instituciones dms_instituciones_municipales instituciones_municipales_q municipales_q_c q_c_est c_est_sacando est_sacando_exceso sacando_exceso_d exceso_d_personal d_personal_q personal_q_m q_m_parece m_parece_correcto parece_correcto_pero correcto_pero_c pero_c_debera c_debera_no debera_no_contratar no_contratar_ms contratar_ms_gent ms_gent_o gent_o_si o_si_no si_no_d no_d_q d_q_ahorro q_ahorro_hablamos ahorro_hablamos_gracias hablamos_gracias_por gracias_por_la por_la_aclaracin
2019-08-22 03:04:50,100sobre100 100dias100realidades una ciudad que en el ecuador es un ejemplo,100sobre100 100days100realities a city that in Ecuador is an example,neutral,0.0,Canar Ecuador,100sobre100_100dias100realidades 100dias100realidades_una una_ciudad ciudad_que que_en en_el el_ecuador ecuador_es es_un un_ejemplo,100sobre100_100dias100realidades_una 100dias100realidades_una_ciudad una_ciudad_que ciudad_que_en que_en_el en_el_ecuador el_ecuador_es ecuador_es_un es_un_ejemplo
2019-08-22 03:01:19,100sobre100 游녧que nada lo detenga siga mostrando transparencia 100dias100realidades,100 over 100 that nothing stops you continue to show transparency 100days100realities,neutral,0.0,,100sobre100_que que_nada nada_lo lo_detenga detenga_siga siga_mostrando mostrando_transparencia transparencia_100dias100realidades,100sobre100_que_nada que_nada_lo nada_lo_detenga lo_detenga_siga detenga_siga_mostrando siga_mostrando_transparencia mostrando_transparencia_100dias100realidades
2019-08-22 02:57:44,cuenca: el alcalde en un an치lisis de sus 100 primeros d칤as de gesti칩n. en vivo por la se침al de ciudad 101.7 fm.,the mayor basins in an analysis of his first 100 days of live management by the city seal 1017 fm,positivo,0.19318181818181818,Cuenca Ecuador,cuenca_el el_alcalde alcalde_en en_un un_anlisis anlisis_de de_sus sus_100 100_primeros primeros_das das_de de_gestin gestin_en en_vivo vivo_por por_la la_seal seal_de de_ciudad ciudad_1017 1017_fm,cuenca_el_alcalde el_alcalde_en alcalde_en_un en_un_anlisis un_anlisis_de anlisis_de_sus de_sus_100 sus_100_primeros 100_primeros_das primeros_das_de das_de_gestin de_gestin_en gestin_en_vivo en_vivo_por vivo_por_la por_la_seal la_seal_de seal_de_ciudad de_ciudad_1017 ciudad_1017_fm
2019-08-22 02:56:53,cuenca tiene un nuevo horizonte. el trabajo empieza y ya hay logros. la nueva visi칩n que cambia para bien la ciudad. el liderazgo de se nota. 100sobre100 100d칤as100realidades,Cuenca has a new horizon the work begins and there are already achievements the new vision that changes the city for good the leadership of 100 is noted over 100 100 100 realities,positivo,0.3242424242424242,Cuenca Ecuador,cuenca_tiene tiene_un un_nuevo nuevo_horizonte horizonte_el el_trabajo trabajo_empieza empieza_y y_ya ya_hay hay_logros logros_la la_nueva nueva_visin visin_que que_cambia cambia_para para_bien bien_la la_ciudad ciudad_el el_liderazgo liderazgo_de de_se se_nota nota_100sobre100 100sobre100_100das100realidades,cuenca_tiene_un tiene_un_nuevo un_nuevo_horizonte nuevo_horizonte_el horizonte_el_trabajo el_trabajo_empieza trabajo_empieza_y empieza_y_ya y_ya_hay ya_hay_logros hay_logros_la logros_la_nueva la_nueva_visin nueva_visin_que visin_que_cambia que_cambia_para cambia_para_bien para_bien_la bien_la_ciudad la_ciudad_el ciudad_el_liderazgo el_liderazgo_de liderazgo_de_se de_se_nota se_nota_100sobre100 nota_100sobre100_100das100realidades
2019-08-22 02:52:52,explica la necesidad de tener un mercado mayorista para la ciudad que sea de uso exclusivo para los comerciantes mayor칤stas.,explains the need to have a wholesale market for the city that is exclusively for wholesale traders,neutral,0.0,,explica_la la_necesidad necesidad_de de_tener tener_un un_mercado mercado_mayorista mayorista_para para_la la_ciudad ciudad_que que_sea sea_de de_uso uso_exclusivo exclusivo_para para_los los_comerciantes comerciantes_mayorstas,explica_la_necesidad la_necesidad_de necesidad_de_tener de_tener_un tener_un_mercado un_mercado_mayorista mercado_mayorista_para mayorista_para_la para_la_ciudad la_ciudad_que ciudad_que_sea que_sea_de sea_de_uso de_uso_exclusivo uso_exclusivo_para exclusivo_para_los para_los_comerciantes los_comerciantes_mayorstas
2019-08-22 02:51:56,periodistas reconocidos de cuenca entre ellos entrevistan al  sobre los primeros 100 d칤as de su gesti칩n. 100sobre100,recognized journalists from the basin among them interview the envelope of the first 100 days of their management 100 over 100,positivo,0.25,Cuenca Ecuador,periodistas_reconocidos reconocidos_de de_cuenca cuenca_entre entre_ellos ellos_entrevistan entrevistan_al al_sobre sobre_los los_primeros primeros_100 100_das das_de de_su su_gestin gestin_100sobre100,periodistas_reconocidos_de reconocidos_de_cuenca de_cuenca_entre cuenca_entre_ellos entre_ellos_entrevistan ellos_entrevistan_al entrevistan_al_sobre al_sobre_los sobre_los_primeros los_primeros_100 primeros_100_das 100_das_de das_de_su de_su_gestin su_gestin_100sobre100
2019-08-22 02:35:22,mi estimada lo que m치s la importa ahora al alcalde es hacer marchas para ver si sigue teniendo la misma simpat칤a para seguir en el poder as칤 van hacer estos a침os de gobierno,My dear what matters most to the mayor now is to make marches to see if he still has the same sympathy to continue in power as these years of government are going to do,positivo,0.25,,mi_estimada estimada_lo lo_que que_ms ms_la la_importa importa_ahora ahora_al al_alcalde alcalde_es es_hacer hacer_marchas marchas_para para_ver ver_si si_sigue sigue_teniendo teniendo_la la_misma misma_simpata simpata_para para_seguir seguir_en en_el el_poder poder_as as_van van_hacer hacer_estos estos_aos aos_de de_gobierno,mi_estimada_lo estimada_lo_que lo_que_ms que_ms_la ms_la_importa la_importa_ahora importa_ahora_al ahora_al_alcalde al_alcalde_es alcalde_es_hacer es_hacer_marchas hacer_marchas_para marchas_para_ver para_ver_si ver_si_sigue si_sigue_teniendo sigue_teniendo_la teniendo_la_misma la_misma_simpata misma_simpata_para simpata_para_seguir para_seguir_en seguir_en_el en_el_poder el_poder_as poder_as_van as_van_hacer van_hacer_estos hacer_estos_aos estos_aos_de aos_de_gobierno
2019-08-22 02:34:29,que diferente un alcalde cercano livianito para dialogar claro en su actuar 100 d칤as de hacer buena pol칤tica alcalde ciudadano,how different a light nearby mayor to dialogue clearly in his actions 100 days of doing good citizen mayor policy,positivo,0.3,Cuenca Ecuador,que_diferente diferente_un un_alcalde alcalde_cercano cercano_livianito livianito_para para_dialogar dialogar_claro claro_en en_su su_actuar actuar_100 100_das das_de de_hacer hacer_buena buena_poltica poltica_alcalde alcalde_ciudadano,que_diferente_un diferente_un_alcalde un_alcalde_cercano alcalde_cercano_livianito cercano_livianito_para livianito_para_dialogar para_dialogar_claro dialogar_claro_en claro_en_su en_su_actuar su_actuar_100 actuar_100_das 100_das_de das_de_hacer de_hacer_buena hacer_buena_poltica buena_poltica_alcalde poltica_alcalde_ciudadano
2019-08-22 02:30:20,el alcalde ing. pedro palacios u. frente a la prensa en sus primeros 100 d칤as. v칠anos en vivo por facebook en: cuenca ecuador azuay ciendias,the mayor ing pedro palacios u in front of the press in his first 100 days in vain live on facebook in ecuador azuay ciendias basin,positivo,0.19318181818181818,,el_alcalde alcalde_ing ing_pedro pedro_palacios palacios_u u_frente frente_a a_la la_prensa prensa_en en_sus sus_primeros primeros_100 100_das das_vanos vanos_en en_vivo vivo_por por_facebook facebook_en en_cuenca cuenca_ecuador ecuador_azuay azuay_ciendias,el_alcalde_ing alcalde_ing_pedro ing_pedro_palacios pedro_palacios_u palacios_u_frente u_frente_a frente_a_la a_la_prensa la_prensa_en prensa_en_sus en_sus_primeros sus_primeros_100 primeros_100_das 100_das_vanos das_vanos_en vanos_en_vivo en_vivo_por vivo_por_facebook por_facebook_en facebook_en_cuenca en_cuenca_ecuador cuenca_ecuador_azuay ecuador_azuay_ciendias
2019-08-22 02:58:32,el  pedro palacios en su informe a la ciudad sobre sus 100 d칤as de gesti칩n. 100sobre100 cuencaunida,Pedro Palacios in his report to the city on his 100 days of management 100 over 100 Cuenca,neutral,0.0,Cuenca Ecuador,el_pedro pedro_palacios palacios_en en_su su_informe informe_a a_la la_ciudad ciudad_sobre sobre_sus sus_100 100_das das_de de_gestin gestin_100sobre100 100sobre100_cuencaunida,el_pedro_palacios pedro_palacios_en palacios_en_su en_su_informe su_informe_a informe_a_la a_la_ciudad la_ciudad_sobre ciudad_sobre_sus sobre_sus_100 sus_100_das 100_das_de das_de_gestin de_gestin_100sobre100 gestin_100sobre100_cuencaunida
2019-08-22 02:57:44,cuenca: el alcalde en un an치lisis de sus 100 primeros d칤as de gesti칩n. en vivo por la se침al de ciudad 101.7 fm.,the mayor basins in an analysis of his first 100 days of live management by the city seal 1017 fm,positivo,0.19318181818181818,Cuenca Ecuador,cuenca_el el_alcalde alcalde_en en_un un_anlisis anlisis_de de_sus sus_100 100_primeros primeros_das das_de de_gestin gestin_en en_vivo vivo_por por_la la_seal seal_de de_ciudad ciudad_1017 1017_fm,cuenca_el_alcalde el_alcalde_en alcalde_en_un en_un_anlisis un_anlisis_de anlisis_de_sus de_sus_100 sus_100_primeros 100_primeros_das primeros_das_de das_de_gestin de_gestin_en gestin_en_vivo en_vivo_por vivo_por_la por_la_seal la_seal_de seal_de_ciudad de_ciudad_1017 ciudad_1017_fm
2019-08-22 02:51:56,periodistas reconocidos de cuenca entre ellos entrevistan al  sobre los primeros 100 d칤as de su gesti칩n. 100sobre100,recognized journalists from the basin among them interview the envelope of the first 100 days of their management 100 over 100,positivo,0.25,Cuenca Ecuador,periodistas_reconocidos reconocidos_de de_cuenca cuenca_entre entre_ellos ellos_entrevistan entrevistan_al al_sobre sobre_los los_primeros primeros_100 100_das das_de de_su su_gestin gestin_100sobre100,periodistas_reconocidos_de reconocidos_de_cuenca de_cuenca_entre cuenca_entre_ellos entre_ellos_entrevistan ellos_entrevistan_al entrevistan_al_sobre al_sobre_los sobre_los_primeros los_primeros_100 primeros_100_das 100_das_de das_de_su de_su_gestin su_gestin_100sobre100
2019-08-22 02:19:23,se pronuncia sobre las gestiones que se a realizado para optimizar el trabajo de la guardia ciudadana,It pronounces on the efforts that have been made to optimize the work of the citizen guard,neutral,0.0,,se_pronuncia pronuncia_sobre sobre_las las_gestiones gestiones_que que_se se_a a_realizado realizado_para para_optimizar optimizar_el el_trabajo trabajo_de de_la la_guardia guardia_ciudadana,se_pronuncia_sobre pronuncia_sobre_las sobre_las_gestiones las_gestiones_que gestiones_que_se que_se_a se_a_realizado a_realizado_para realizado_para_optimizar para_optimizar_el optimizar_el_trabajo el_trabajo_de trabajo_de_la de_la_guardia la_guardia_ciudadana
2019-08-22 02:13:47,siga en vivo la entrevista a alcalde de cuenca 100sobre100 100d칤as100realidades,follow live the interview to mayor of Cuenca 100 over 100 100 100 realities,positivo,0.13636363636363635,Cuenca Ecuador,siga_en en_vivo vivo_la la_entrevista entrevista_a a_alcalde alcalde_de de_cuenca cuenca_100sobre100 100sobre100_100das100realidades,siga_en_vivo en_vivo_la vivo_la_entrevista la_entrevista_a entrevista_a_alcalde a_alcalde_de alcalde_de_cuenca de_cuenca_100sobre100 cuenca_100sobre100_100das100realidades
2019-08-22 02:13:00,siga en vivo la entrevista a alcalde de cuenca 100sobre100 100d칤as100realidades,follow live the interview to mayor of Cuenca 100 over 100 100 100 realities,positivo,0.13636363636363635,Cuenca Ecuador,siga_en en_vivo vivo_la la_entrevista entrevista_a a_alcalde alcalde_de de_cuenca cuenca_100sobre100 100sobre100_100das100realidades,siga_en_vivo en_vivo_la vivo_la_entrevista la_entrevista_a entrevista_a_alcalde a_alcalde_de alcalde_de_cuenca de_cuenca_100sobre100 cuenca_100sobre100_100das100realidades
2019-08-22 02:04:23,iniciamos el di치logo con el alcalde cuenca an치lisis de los 100 d칤as de labores al frente del,We began the dialogue with the mayor Cuenca analysis of the 100 days of work in front of the,neutral,0.0,,iniciamos_el el_dilogo dilogo_con con_el el_alcalde alcalde_cuenca cuenca_anlisis anlisis_de de_los los_100 100_das das_de de_labores labores_al al_frente frente_del,iniciamos_el_dilogo el_dilogo_con dilogo_con_el con_el_alcalde el_alcalde_cuenca alcalde_cuenca_anlisis cuenca_anlisis_de anlisis_de_los de_los_100 los_100_das 100_das_de das_de_labores de_labores_al labores_al_frente al_frente_del
2019-08-22 01:36:04,acompa침amos a  a la asamblea ciudadana que se desarrolla en la "ciudadela kennedy" donde se conocen los requerimientos planteados por los moradores del sector.,We accompany the citizen assembly that takes place in the Kennedy Citadel where the requirements raised by the residents of the sector are known,neutral,0.0,Cuenca Ecuador,acompaamos_a a_a a_la la_asamblea asamblea_ciudadana ciudadana_que que_se se_desarrolla desarrolla_en en_la la_ciudadela ciudadela_kennedy kennedy_donde donde_se se_conocen conocen_los los_requerimientos requerimientos_planteados planteados_por por_los los_moradores moradores_del del_sector,acompaamos_a_a a_a_la a_la_asamblea la_asamblea_ciudadana asamblea_ciudadana_que ciudadana_que_se que_se_desarrolla se_desarrolla_en desarrolla_en_la en_la_ciudadela la_ciudadela_kennedy ciudadela_kennedy_donde kennedy_donde_se donde_se_conocen se_conocen_los conocen_los_requerimientos los_requerimientos_planteados requerimientos_planteados_por planteados_por_los por_los_moradores los_moradores_del moradores_del_sector
2019-08-22 01:34:06,informe 100d칤asdegesti칩n 游늷alcalde  esfu칠rcese en hacer lo que usted quiera en lugar de lo que los dem치s piensan que tiene que hacer. apoyo incondicional,100dadegestin mayor report strive to do what you want instead of what others think you have to do unconditional support,neutral,0.0,,informe_100dasdegestin 100dasdegestin_alcalde alcalde_esfurcese esfurcese_en en_hacer hacer_lo lo_que que_usted usted_quiera quiera_en en_lugar lugar_de de_lo lo_que que_los los_dems dems_piensan piensan_que que_tiene tiene_que que_hacer hacer_apoyo apoyo_incondicional,informe_100dasdegestin_alcalde 100dasdegestin_alcalde_esfurcese alcalde_esfurcese_en esfurcese_en_hacer en_hacer_lo hacer_lo_que lo_que_usted que_usted_quiera usted_quiera_en quiera_en_lugar en_lugar_de lugar_de_lo de_lo_que lo_que_los que_los_dems los_dems_piensan dems_piensan_que piensan_que_tiene que_tiene_que tiene_que_hacer que_hacer_apoyo hacer_apoyo_incondicional
2019-08-22 01:21:29,el no ha entendido que el problema que tiene es de gesti칩n mas no pol칤tico 100dias,He has not understood that the problem he has is of management but not political 100days,neutral,0.0,Cuenca Ecuador,el_no no_ha ha_entendido entendido_que que_el el_problema problema_que que_tiene tiene_es es_de de_gestin gestin_mas mas_no no_poltico poltico_100dias,el_no_ha no_ha_entendido ha_entendido_que entendido_que_el que_el_problema el_problema_que problema_que_tiene que_tiene_es tiene_es_de es_de_gestin de_gestin_mas gestin_mas_no mas_no_poltico no_poltico_100dias
