creado,texto_es,texto_en,polaridad,valor_polaridad,ubicacion_usuario,terminos_2, terminos_3
2019-08-20 17:34:03,😂😂😂😂 te convertiste en lo q criticabas y molestabas como cambia. las cosas verdad y tu 100 dias no veo nada de avences ni los huecos debla ciudad has bacheado... 100 dias a vaca diria yo,you became what you criticized and bothered as things change true and your 100 days I see nothing of avenues nor the gaps of the city you have bumpled 100 days a cow I would say,positivo,0.10833333333333332,Tierra,te_convertiste convertiste_en en_lo lo_q q_criticabas criticabas_y y_molestabas molestabas_como como_cambia cambia_las las_cosas cosas_verdad verdad_y y_tu tu_100 100_dias dias_no no_veo veo_nada nada_de de_avences avences_ni ni_los los_huecos huecos_debla debla_ciudad ciudad_has has_bacheado bacheado_100 100_dias dias_a a_vaca vaca_diria diria_yo,te_convertiste_en convertiste_en_lo en_lo_q lo_q_criticabas q_criticabas_y criticabas_y_molestabas y_molestabas_como molestabas_como_cambia como_cambia_las cambia_las_cosas las_cosas_verdad cosas_verdad_y verdad_y_tu y_tu_100 tu_100_dias 100_dias_no dias_no_veo no_veo_nada veo_nada_de nada_de_avences de_avences_ni avences_ni_los ni_los_huecos los_huecos_debla huecos_debla_ciudad debla_ciudad_has ciudad_has_bacheado has_bacheado_100 bacheado_100_dias 100_dias_a dias_a_vaca a_vaca_diria vaca_diria_yo
2019-08-20 17:30:06,majestuoso con estos videos se ratifica cuan hermosa y maravillosa es nuestra tierra. gracias por hacer partícipes del deleite.,majestic with these videos it is ratified how beautiful and wonderful our land is thank you for participating in the delight,positivo,0.925,,majestuoso_con con_estos estos_videos videos_se se_ratifica ratifica_cuan cuan_hermosa hermosa_y y_maravillosa maravillosa_es es_nuestra nuestra_tierra tierra_gracias gracias_por por_hacer hacer_partcipes partcipes_del del_deleite,majestuoso_con_estos con_estos_videos estos_videos_se videos_se_ratifica se_ratifica_cuan ratifica_cuan_hermosa cuan_hermosa_y hermosa_y_maravillosa y_maravillosa_es maravillosa_es_nuestra es_nuestra_tierra nuestra_tierra_gracias tierra_gracias_por gracias_por_hacer por_hacer_partcipes hacer_partcipes_del partcipes_del_deleite
2019-08-20 17:23:41,97/100 más obras y los ciudadanos los saben cumplir con los ejes que la ciudad lo requiere movilidad trabajo transporte vialidad y sanidad vamos con todo,97100 ms works and citizens know how to comply with the axes that the city requires mobility work transport road and health we are going,neutral,0.0,ECUADOR,97100_ms ms_obras obras_y y_los los_ciudadanos ciudadanos_los los_saben saben_cumplir cumplir_con con_los los_ejes ejes_que que_la la_ciudad ciudad_lo lo_requiere requiere_movilidad movilidad_trabajo trabajo_transporte transporte_vialidad vialidad_y y_sanidad sanidad_vamos vamos_con con_todo,97100_ms_obras ms_obras_y obras_y_los y_los_ciudadanos los_ciudadanos_los ciudadanos_los_saben los_saben_cumplir saben_cumplir_con cumplir_con_los con_los_ejes los_ejes_que ejes_que_la que_la_ciudad la_ciudad_lo ciudad_lo_requiere lo_requiere_movilidad requiere_movilidad_trabajo movilidad_trabajo_transporte trabajo_transporte_vialidad transporte_vialidad_y vialidad_y_sanidad y_sanidad_vamos sanidad_vamos_con vamos_con_todo
2019-08-20 17:19:33,ojalá pronto revise los cobros indebidos en la revisión vehicular que realiza la que haga algo la,hopefully soon review the improper charges in the vehicle review that makes the do something,neutral,0.0,Mi hermosa CuencaEcuador,ojal_pronto pronto_revise revise_los los_cobros cobros_indebidos indebidos_en en_la la_revisin revisin_vehicular vehicular_que que_realiza realiza_la la_que que_haga haga_algo algo_la,ojal_pronto_revise pronto_revise_los revise_los_cobros los_cobros_indebidos cobros_indebidos_en indebidos_en_la en_la_revisin la_revisin_vehicular revisin_vehicular_que vehicular_que_realiza que_realiza_la realiza_la_que la_que_haga que_haga_algo haga_algo_la
2019-08-20 17:18:12,fomentamos el uso de medios de transporte no motorizados. compartimos con los niños de la comunidad san pedro perteneciente a victoria del portete. muéveteenbici biciescuela,We encourage the use of nonmotorized means of transport we share with the children of the San Pedro community belonging to Victoria del Portete Muveteenbici Bicescuela,neutral,0.0,,fomentamos_el el_uso uso_de de_medios medios_de de_transporte transporte_no no_motorizados motorizados_compartimos compartimos_con con_los los_nios nios_de de_la la_comunidad comunidad_san san_pedro pedro_perteneciente perteneciente_a a_victoria victoria_del del_portete portete_muveteenbici muveteenbici_biciescuela,fomentamos_el_uso el_uso_de uso_de_medios de_medios_de medios_de_transporte de_transporte_no transporte_no_motorizados no_motorizados_compartimos motorizados_compartimos_con compartimos_con_los con_los_nios los_nios_de nios_de_la de_la_comunidad la_comunidad_san comunidad_san_pedro san_pedro_perteneciente pedro_perteneciente_a perteneciente_a_victoria a_victoria_del victoria_del_portete del_portete_muveteenbici portete_muveteenbici_biciescuela
2019-08-20 17:17:00,98sobre100 los primeros 100 días de gestión exitosa de nuestro alcalde,98 over 100 the first 100 days of successful management of our mayor,positivo,0.5,,98sobre100_los los_primeros primeros_100 100_das das_de de_gestin gestin_exitosa exitosa_de de_nuestro nuestro_alcalde,98sobre100_los_primeros los_primeros_100 primeros_100_das 100_das_de das_de_gestin de_gestin_exitosa gestin_exitosa_de exitosa_de_nuestro de_nuestro_alcalde
2019-08-20 17:00:14,señor alcalde cuando me recive en su despacho ....quisiera abordar un tema con usted,Mr Mayor when you receive me in your office I would like to discuss a topic with you,neutral,0.0,salinas,seor_alcalde alcalde_cuando cuando_me me_recive recive_en en_su su_despacho despacho_quisiera quisiera_abordar abordar_un un_tema tema_con con_usted,seor_alcalde_cuando alcalde_cuando_me cuando_me_recive me_recive_en recive_en_su en_su_despacho su_despacho_quisiera despacho_quisiera_abordar quisiera_abordar_un abordar_un_tema un_tema_con tema_con_usted
2019-08-20 16:59:54,dgrinforma👇🏻 reporte de vías ⚠ fecha: 20/08/2019 hora de corte: 11h30 fuente:,dgrinforma vas report dated 20082019 cutting time 11h30 source,negativo,-0.6,Cuenca Ecuador,dgrinforma_reporte reporte_de de_vas vas_fecha fecha_20082019 20082019_hora hora_de de_corte corte_11h30 11h30_fuente,dgrinforma_reporte_de reporte_de_vas de_vas_fecha vas_fecha_20082019 fecha_20082019_hora 20082019_hora_de hora_de_corte de_corte_11h30 corte_11h30_fuente
2019-08-20 16:55:04,esa es la verdadera participacion ciudadana 98sobre100,that is the true citizen participation 98sobre100,positivo,0.35,,esa_es es_la la_verdadera verdadera_participacion participacion_ciudadana ciudadana_98sobre100,esa_es_la es_la_verdadera la_verdadera_participacion verdadera_participacion_ciudadana participacion_ciudadana_98sobre100
2019-08-20 16:53:23,artesanos del país exigen a la junta electoral convocatoria a elecciones ciudadanía opina gestión del alcalde en sus 100 primero días frente del esta y otras noticias en la día a las 13h30,artisans of the country require the electoral board to call citizen elections in the first 100 days before the east and other news in the day at 1330,positivo,0.0625,,artesanos_del del_pas pas_exigen exigen_a a_la la_junta junta_electoral electoral_convocatoria convocatoria_a a_elecciones elecciones_ciudadana ciudadana_opina opina_gestin gestin_del del_alcalde alcalde_en en_sus sus_100 100_primero primero_das das_frente frente_del del_esta esta_y y_otras otras_noticias noticias_en en_la la_da da_a a_las las_13h30,artesanos_del_pas del_pas_exigen pas_exigen_a exigen_a_la a_la_junta la_junta_electoral junta_electoral_convocatoria electoral_convocatoria_a convocatoria_a_elecciones a_elecciones_ciudadana elecciones_ciudadana_opina ciudadana_opina_gestin opina_gestin_del gestin_del_alcalde del_alcalde_en alcalde_en_sus en_sus_100 sus_100_primero 100_primero_das primero_das_frente das_frente_del frente_del_esta del_esta_y esta_y_otras y_otras_noticias otras_noticias_en noticias_en_la en_la_da la_da_a da_a_las a_las_13h30
2019-08-20 16:49:25,y se rodeará de un montón de aduladores cuidado. amigodatecuenta,and surround yourself with a lot of flatterers care friend,neutral,0.0,Cuenca Ecuador,y_se se_rodear rodear_de de_un un_montn montn_de de_aduladores aduladores_cuidado cuidado_amigodatecuenta,y_se_rodear se_rodear_de rodear_de_un de_un_montn un_montn_de montn_de_aduladores de_aduladores_cuidado aduladores_cuidado_amigodatecuenta
2019-08-20 16:48:12,señor alcalde ud haga lo q tiene q hacer como administador q esno haga caso los ambiciosos políticos q le rodearon luego de elecciones. no caiga en estas cosas que lo vuelven un politiquero figureti mas. a quien le recomendó hacer esta marcha despídalo.,Mr Mayor do what you have to do as an administrator who ignores the ambitious politicians who surrounded him after the elections Do not fall for these things that make him a politician figure but who would recommend doing this march,positivo,0.25,Cuenca Ecuador,seor_alcalde alcalde_ud ud_haga haga_lo lo_q q_tiene tiene_q q_hacer hacer_como como_administador administador_q q_esno esno_haga haga_caso caso_los los_ambiciosos ambiciosos_polticos polticos_q q_le le_rodearon rodearon_luego luego_de de_elecciones elecciones_no no_caiga caiga_en en_estas estas_cosas cosas_que que_lo lo_vuelven vuelven_un un_politiquero politiquero_figureti figureti_mas mas_a a_quien quien_le le_recomend recomend_hacer hacer_esta esta_marcha marcha_despdalo,seor_alcalde_ud alcalde_ud_haga ud_haga_lo haga_lo_q lo_q_tiene q_tiene_q tiene_q_hacer q_hacer_como hacer_como_administador como_administador_q administador_q_esno q_esno_haga esno_haga_caso haga_caso_los caso_los_ambiciosos los_ambiciosos_polticos ambiciosos_polticos_q polticos_q_le q_le_rodearon le_rodearon_luego rodearon_luego_de luego_de_elecciones de_elecciones_no elecciones_no_caiga no_caiga_en caiga_en_estas en_estas_cosas estas_cosas_que cosas_que_lo que_lo_vuelven lo_vuelven_un vuelven_un_politiquero un_politiquero_figureti politiquero_figureti_mas figureti_mas_a mas_a_quien a_quien_le quien_le_recomend le_recomend_hacer recomend_hacer_esta hacer_esta_marcha esta_marcha_despdalo
2019-08-20 16:44:09,se debe tomar medidas ya sobre la inseguridad como lo está haciendo cynthia viteri como lo esta haciendo por guayaquil pero no esto no es importante para la ciudad,Measures should already be taken on insecurity as Cynthia Viteri is doing as she is doing for Guayaquil but not this is not important for the city,negativo,-0.2,Ecuador,se_debe debe_tomar tomar_medidas medidas_ya ya_sobre sobre_la la_inseguridad inseguridad_como como_lo lo_est est_haciendo haciendo_cynthia cynthia_viteri viteri_como como_lo lo_esta esta_haciendo haciendo_por por_guayaquil guayaquil_pero pero_no no_esto esto_no no_es es_importante importante_para para_la la_ciudad,se_debe_tomar debe_tomar_medidas tomar_medidas_ya medidas_ya_sobre ya_sobre_la sobre_la_inseguridad la_inseguridad_como inseguridad_como_lo como_lo_est lo_est_haciendo est_haciendo_cynthia haciendo_cynthia_viteri cynthia_viteri_como viteri_como_lo como_lo_esta lo_esta_haciendo esta_haciendo_por haciendo_por_guayaquil por_guayaquil_pero guayaquil_pero_no pero_no_esto no_esto_no esto_no_es no_es_importante es_importante_para importante_para_la para_la_ciudad
2019-08-20 16:42:26,apoyo total 100 realidades en 100 días nos demuestra que cosas grandes están por venir cuencaunida 97sobre100,Total support 100 realities in 100 days shows us that great things are yet to come in Cuenca 97 over 100,positivo,0.4,,apoyo_total total_100 100_realidades realidades_en en_100 100_das das_nos nos_demuestra demuestra_que que_cosas cosas_grandes grandes_estn estn_por por_venir venir_cuencaunida cuencaunida_97sobre100,apoyo_total_100 total_100_realidades 100_realidades_en realidades_en_100 en_100_das 100_das_nos das_nos_demuestra nos_demuestra_que demuestra_que_cosas que_cosas_grandes cosas_grandes_estn grandes_estn_por estn_por_venir por_venir_cuencaunida venir_cuencaunida_97sobre100
2019-08-20 16:41:09,cien días de mucho trabajo y buenos resultados. vamos por más cuencaunida 98sobre100,one hundred days of hard work and good results we go for more basin 98 over 100,positivo,0.30277777777777776,Cuenca  Ecuador,cien_das das_de de_mucho mucho_trabajo trabajo_y y_buenos buenos_resultados resultados_vamos vamos_por por_ms ms_cuencaunida cuencaunida_98sobre100,cien_das_de das_de_mucho de_mucho_trabajo mucho_trabajo_y trabajo_y_buenos y_buenos_resultados buenos_resultados_vamos resultados_vamos_por vamos_por_ms por_ms_cuencaunida ms_cuencaunida_98sobre100
2019-08-20 16:40:29,le cuento que la gente ya está organizandose para la revocatoria de su mandato y la de su hermano hugo que tiene aires de jefe,I tell him that people are already organizing for the revocation of his mandate and that of his brother Hugo who has the air of boss,neutral,0.0,Ecuador,le_cuento cuento_que que_la la_gente gente_ya ya_est est_organizandose organizandose_para para_la la_revocatoria revocatoria_de de_su su_mandato mandato_y y_la la_de de_su su_hermano hermano_hugo hugo_que que_tiene tiene_aires aires_de de_jefe,le_cuento_que cuento_que_la que_la_gente la_gente_ya gente_ya_est ya_est_organizandose est_organizandose_para organizandose_para_la para_la_revocatoria la_revocatoria_de revocatoria_de_su de_su_mandato su_mandato_y mandato_y_la y_la_de la_de_su de_su_hermano su_hermano_hugo hermano_hugo_que hugo_que_tiene que_tiene_aires tiene_aires_de aires_de_jefe
2019-08-20 16:37:05,cuencaunida para trabajar por la seguridad y bienestar de los ciudadanos. son cien días cien realidades y esto es el comienzo de nuestra gestión. 98sobre100,Basin to work for the safety and welfare of citizens are one hundred and one hundred realities and this is the beginning of our management 98 over 100,neutral,0.0,Ecuador,cuencaunida_para para_trabajar trabajar_por por_la la_seguridad seguridad_y y_bienestar bienestar_de de_los los_ciudadanos ciudadanos_son son_cien cien_das das_cien cien_realidades realidades_y y_esto esto_es es_el el_comienzo comienzo_de de_nuestra nuestra_gestin gestin_98sobre100,cuencaunida_para_trabajar para_trabajar_por trabajar_por_la por_la_seguridad la_seguridad_y seguridad_y_bienestar y_bienestar_de bienestar_de_los de_los_ciudadanos los_ciudadanos_son ciudadanos_son_cien son_cien_das cien_das_cien das_cien_realidades cien_realidades_y realidades_y_esto y_esto_es esto_es_el es_el_comienzo el_comienzo_de comienzo_de_nuestra de_nuestra_gestin nuestra_gestin_98sobre100
2019-08-20 16:36:54,el trabajo inicia 98sobre100,work starts 98 over 100,neutral,0.0,Canar Ecuador,el_trabajo trabajo_inicia inicia_98sobre100,el_trabajo_inicia trabajo_inicia_98sobre100
2019-08-20 16:36:38,que pleno done están,how full are they,positivo,0.35,,que_pleno pleno_done done_estn,que_pleno_done pleno_done_estn
2019-08-20 16:33:12,98sobre100 👏👏 cuencaunida en beneficio de los cuencanos y cuencanos. es el inicio de una gran gestión.,98 over 100 basin for the benefit of the basins and basins is the beginning of a great management,positivo,0.8,Cuenca Ecuador,98sobre100_cuencaunida cuencaunida_en en_beneficio beneficio_de de_los los_cuencanos cuencanos_y y_cuencanos cuencanos_es es_el el_inicio inicio_de de_una una_gran gran_gestin,98sobre100_cuencaunida_en cuencaunida_en_beneficio en_beneficio_de beneficio_de_los de_los_cuencanos los_cuencanos_y cuencanos_y_cuencanos y_cuencanos_es cuencanos_es_el es_el_inicio el_inicio_de inicio_de_una de_una_gran una_gran_gestin
2019-08-20 16:31:02,es solo el comienzo de una buena gestión. cuencaunida en todos los ámbitos. 98sobre100,it is only the beginning of a good united basin management in all areas 98sobre100,positivo,0.35,Cuenca Ecuador,es_solo solo_el el_comienzo comienzo_de de_una una_buena buena_gestin gestin_cuencaunida cuencaunida_en en_todos todos_los los_mbitos mbitos_98sobre100,es_solo_el solo_el_comienzo el_comienzo_de comienzo_de_una de_una_buena una_buena_gestin buena_gestin_cuencaunida gestin_cuencaunida_en cuencaunida_en_todos en_todos_los todos_los_mbitos los_mbitos_98sobre100
2019-08-20 16:29:51,los ñutos son clave importante para las autoridades eso habla bien de ello que sigan así mismo con una cuencaunida 98sobre100,the cars are important key for the authorities that speaks well of it that they follow with a basin 98sobre100,positivo,0.2,,los_utos utos_son son_clave clave_importante importante_para para_las las_autoridades autoridades_eso eso_habla habla_bien bien_de de_ello ello_que que_sigan sigan_as as_mismo mismo_con con_una una_cuencaunida cuencaunida_98sobre100,los_utos_son utos_son_clave son_clave_importante clave_importante_para importante_para_las para_las_autoridades las_autoridades_eso autoridades_eso_habla eso_habla_bien habla_bien_de bien_de_ello de_ello_que ello_que_sigan que_sigan_as sigan_as_mismo as_mismo_con mismo_con_una con_una_cuencaunida una_cuencaunida_98sobre100
2019-08-20 16:26:38,más y más obras para esta bella ciudad cuencaunida 98sobre100,ms and ms works for this beautiful city basin 98sobre100,positivo,0.85,,ms_y y_ms ms_obras obras_para para_esta esta_bella bella_ciudad ciudad_cuencaunida cuencaunida_98sobre100,ms_y_ms y_ms_obras ms_obras_para obras_para_esta para_esta_bella esta_bella_ciudad bella_ciudad_cuencaunida ciudad_cuencaunida_98sobre100
2019-08-20 16:26:26,los niños disfrutaron de colonias vacacionales seguras cien días cien realidades. 98sobre100,the children enjoyed safe holiday colonies one hundred and one hundred realities 98 over 100,positivo,0.5,Cuenca  Ecuador,los_nios nios_disfrutaron disfrutaron_de de_colonias colonias_vacacionales vacacionales_seguras seguras_cien cien_das das_cien cien_realidades realidades_98sobre100,los_nios_disfrutaron nios_disfrutaron_de disfrutaron_de_colonias de_colonias_vacacionales colonias_vacacionales_seguras vacacionales_seguras_cien seguras_cien_das cien_das_cien das_cien_realidades cien_realidades_98sobre100
2019-08-20 16:22:22,trabajamos por y para 98sobre100 cuencaunida,We work for and for 98 over 100 Cuenca,neutral,0.0,Cuenca  Ecuador,trabajamos_por por_y y_para para_98sobre100 98sobre100_cuencaunida,trabajamos_por_y por_y_para y_para_98sobre100 para_98sobre100_cuencaunida
2019-08-20 16:20:41,comparto opinión de la gestión de 98sobre100 en cuenca prueba de que lo políticamente correcto no es el camino vía,I share 98sobre100 management opinion in basin proof that the politically correct is not the way it goes,neutral,0.0,,comparto_opinin opinin_de de_la la_gestin gestin_de de_98sobre100 98sobre100_en en_cuenca cuenca_prueba prueba_de de_que que_lo lo_polticamente polticamente_correcto correcto_no no_es es_el el_camino camino_va,comparto_opinin_de opinin_de_la de_la_gestin la_gestin_de gestin_de_98sobre100 de_98sobre100_en 98sobre100_en_cuenca en_cuenca_prueba cuenca_prueba_de prueba_de_que de_que_lo que_lo_polticamente lo_polticamente_correcto polticamente_correcto_no correcto_no_es no_es_el es_el_camino el_camino_va
2019-08-20 16:20:36,cuenca: se llevó a cabo el lanzamiento de la campaña voyalaruta el objetivo es reactivar la actividad comercial a lo largo de la ruta tranviaria.,basin was carried out the launch of the voyalaruta campaign the objective is to reactivate the commercial activity along the tram route,neutral,0.0,Cuenca Ecuador,cuenca_se se_llev llev_a a_cabo cabo_el el_lanzamiento lanzamiento_de de_la la_campaa campaa_voyalaruta voyalaruta_el el_objetivo objetivo_es es_reactivar reactivar_la la_actividad actividad_comercial comercial_a a_lo lo_largo largo_de de_la la_ruta ruta_tranviaria,cuenca_se_llev se_llev_a llev_a_cabo a_cabo_el cabo_el_lanzamiento el_lanzamiento_de lanzamiento_de_la de_la_campaa la_campaa_voyalaruta campaa_voyalaruta_el voyalaruta_el_objetivo el_objetivo_es objetivo_es_reactivar es_reactivar_la reactivar_la_actividad la_actividad_comercial actividad_comercial_a comercial_a_lo a_lo_largo lo_largo_de largo_de_la de_la_ruta la_ruta_tranviaria
2019-08-20 16:17:53,y el tranvía para cuando estará operativo???,and the tram when to be operational,neutral,0.0,,y_el el_tranva tranva_para para_cuando cuando_estar estar_operativo,y_el_tranva el_tranva_para tranva_para_cuando para_cuando_estar cuando_estar_operativo
2019-08-20 16:15:43,espacios para niños y adultos operativos de seguridad mantenimiento vial y mucho más. 98sobre100,spaces for children and adults operational safety road maintenance and much more 98sobre100,positivo,0.5,Cuenca Ecuador,espacios_para para_nios nios_y y_adultos adultos_operativos operativos_de de_seguridad seguridad_mantenimiento mantenimiento_vial vial_y y_mucho mucho_ms ms_98sobre100,espacios_para_nios para_nios_y nios_y_adultos y_adultos_operativos adultos_operativos_de operativos_de_seguridad de_seguridad_mantenimiento seguridad_mantenimiento_vial mantenimiento_vial_y vial_y_mucho y_mucho_ms mucho_ms_98sobre100
2019-08-20 16:13:53,hagan funcionar el.trencito y verán como se reactiva solita la via tranviaria que dicen,run the little train and see how it reactivates alone the tramway they say,negativo,-0.1875,Cuenca,hagan_funcionar funcionar_eltrencito eltrencito_y y_vern vern_como como_se se_reactiva reactiva_solita solita_la la_via via_tranviaria tranviaria_que que_dicen,hagan_funcionar_eltrencito funcionar_eltrencito_y eltrencito_y_vern y_vern_como vern_como_se como_se_reactiva se_reactiva_solita reactiva_solita_la solita_la_via la_via_tranviaria via_tranviaria_que tranviaria_que_dicen
2019-08-20 16:08:39,carolina ormaza dir. informa sobre el cobro de cuatro millones ochocientos mil dólares por concepto de multas a la empresa actn por el tetrazo en la obra por medio del acta de impedimento de mediación.,Carolina Ormaza Dir reports on the collection of four million eight hundred thousand dollars for fines to the company acting for the tetrazo in the work through the act of impeding mediation,neutral,0.0,Cuenca  Ecuador,carolina_ormaza ormaza_dir dir_informa informa_sobre sobre_el el_cobro cobro_de de_cuatro cuatro_millones millones_ochocientos ochocientos_mil mil_dlares dlares_por por_concepto concepto_de de_multas multas_a a_la la_empresa empresa_actn actn_por por_el el_tetrazo tetrazo_en en_la la_obra obra_por por_medio medio_del del_acta acta_de de_impedimento impedimento_de de_mediacin,carolina_ormaza_dir ormaza_dir_informa dir_informa_sobre informa_sobre_el sobre_el_cobro el_cobro_de cobro_de_cuatro de_cuatro_millones cuatro_millones_ochocientos millones_ochocientos_mil ochocientos_mil_dlares mil_dlares_por dlares_por_concepto por_concepto_de concepto_de_multas de_multas_a multas_a_la a_la_empresa la_empresa_actn empresa_actn_por actn_por_el por_el_tetrazo el_tetrazo_en tetrazo_en_la en_la_obra la_obra_por obra_por_medio por_medio_del medio_del_acta del_acta_de acta_de_impedimento de_impedimento_de impedimento_de_mediacin
2019-08-20 16:06:27,colonias vacacionales mantenimiento vial en la gran minga por cuenca vehículos y motocicletas para su seguridad son solo parte de la gestión en estos cien días cien realidades 98sobre100,holiday colonies road maintenance in the great minga by basin vehicles and motorcycles for your safety are only part of the management in these one hundred days one hundred realities 98 over 100,positivo,0.4,,colonias_vacacionales vacacionales_mantenimiento mantenimiento_vial vial_en en_la la_gran gran_minga minga_por por_cuenca cuenca_vehculos vehculos_y y_motocicletas motocicletas_para para_su su_seguridad seguridad_son son_solo solo_parte parte_de de_la la_gestin gestin_en en_estos estos_cien cien_das das_cien cien_realidades realidades_98sobre100,colonias_vacacionales_mantenimiento vacacionales_mantenimiento_vial mantenimiento_vial_en vial_en_la en_la_gran la_gran_minga gran_minga_por minga_por_cuenca por_cuenca_vehculos cuenca_vehculos_y vehculos_y_motocicletas y_motocicletas_para motocicletas_para_su para_su_seguridad su_seguridad_son seguridad_son_solo son_solo_parte solo_parte_de parte_de_la de_la_gestin la_gestin_en gestin_en_estos en_estos_cien estos_cien_das cien_das_cien das_cien_realidades cien_realidades_98sobre100
2019-08-20 16:03:11,colonias vacacionales mantenimiento vial en la gran minga por cuenca vehículos y motocicletas para su seguridad son solo parte de la gestión en estos cien días cien realidades 98sobre100,holiday colonies road maintenance in the great minga by basin vehicles and motorcycles for your safety are only part of the management in these one hundred days one hundred realities 98 over 100,positivo,0.4,,colonias_vacacionales vacacionales_mantenimiento mantenimiento_vial vial_en en_la la_gran gran_minga minga_por por_cuenca cuenca_vehculos vehculos_y y_motocicletas motocicletas_para para_su su_seguridad seguridad_son son_solo solo_parte parte_de de_la la_gestin gestin_en en_estos estos_cien cien_das das_cien cien_realidades realidades_98sobre100,colonias_vacacionales_mantenimiento vacacionales_mantenimiento_vial mantenimiento_vial_en vial_en_la en_la_gran la_gran_minga gran_minga_por minga_por_cuenca por_cuenca_vehculos cuenca_vehculos_y vehculos_y_motocicletas y_motocicletas_para motocicletas_para_su para_su_seguridad su_seguridad_son seguridad_son_solo son_solo_parte solo_parte_de parte_de_la de_la_gestin la_gestin_en gestin_en_estos en_estos_cien estos_cien_das cien_das_cien das_cien_realidades cien_realidades_98sobre100
2019-08-20 15:59:44,juntos fomentamos el desarrollo de nuestra ciudad. 98sobre100,Together we encourage the development of our city 98sobre100,neutral,0.0,Cuenca Ecuador,juntos_fomentamos fomentamos_el el_desarrollo desarrollo_de de_nuestra nuestra_ciudad ciudad_98sobre100,juntos_fomentamos_el fomentamos_el_desarrollo el_desarrollo_de desarrollo_de_nuestra de_nuestra_ciudad nuestra_ciudad_98sobre100
