creado,texto_es,texto_en,polaridad,valor_polaridad,ubicacion_usuario,terminos_2, terminos_3
2019-08-19 17:29:26,inauguró el nuevo edifico del registro de la propiedad el detalle de esta y otras noticias en nuestro noticiero la día de las,opens the new building of the property registry the detail of this and other news in our news the day of the,positivo,0.005681818181818177,,inaugur_el el_nuevo nuevo_edifico edifico_del del_registro registro_de de_la la_propiedad propiedad_el el_detalle detalle_de de_esta esta_y y_otras otras_noticias noticias_en en_nuestro nuestro_noticiero noticiero_la la_da da_de de_las,inaugur_el_nuevo el_nuevo_edifico nuevo_edifico_del edifico_del_registro del_registro_de registro_de_la de_la_propiedad la_propiedad_el propiedad_el_detalle el_detalle_de detalle_de_esta de_esta_y esta_y_otras y_otras_noticias otras_noticias_en noticias_en_nuestro en_nuestro_noticiero nuestro_noticiero_la noticiero_la_da la_da_de da_de_las
2019-08-19 17:28:29,pero sí se trabajó en la pavimentación rígida flexible y reasfaltado de más de 220 km. de vías. continúo laborando en el donde trabajo en la difusión de la información del proyecto de ciudad planteado. gracias por su comentario y estoy a las órdenes.,but I worked on flexible and resurfaced rigid paving of more than 220 km of vas continue to work where I work in the dissemination of the information of the proposed city project thanks for your comment and I am under the orders,positivo,0.35,Cuenca Ecuador,pero_s s_se se_trabaj trabaj_en en_la la_pavimentacin pavimentacin_rgida rgida_flexible flexible_y y_reasfaltado reasfaltado_de de_ms ms_de de_220 220_km km_de de_vas vas_contino contino_laborando laborando_en en_el el_donde donde_trabajo trabajo_en en_la la_difusin difusin_de de_la la_informacin informacin_del del_proyecto proyecto_de de_ciudad ciudad_planteado planteado_gracias gracias_por por_su su_comentario comentario_y y_estoy estoy_a a_las las_rdenes,pero_s_se s_se_trabaj se_trabaj_en trabaj_en_la en_la_pavimentacin la_pavimentacin_rgida pavimentacin_rgida_flexible rgida_flexible_y flexible_y_reasfaltado y_reasfaltado_de reasfaltado_de_ms de_ms_de ms_de_220 de_220_km 220_km_de km_de_vas de_vas_contino vas_contino_laborando contino_laborando_en laborando_en_el en_el_donde el_donde_trabajo donde_trabajo_en trabajo_en_la en_la_difusin la_difusin_de difusin_de_la de_la_informacin la_informacin_del informacin_del_proyecto del_proyecto_de proyecto_de_ciudad de_ciudad_planteado ciudad_planteado_gracias planteado_gracias_por gracias_por_su por_su_comentario su_comentario_y comentario_y_estoy y_estoy_a estoy_a_las a_las_rdenes
2019-08-19 17:28:05,si es así esta medalla al dios de las piramides de egipto que está en 🥇 🤦🏻‍♂️,if so this medal to the god of the pyramids of egypt that is in,neutral,0.0,,si_es es_as as_esta esta_medalla medalla_al al_dios dios_de de_las las_piramides piramides_de de_egipto egipto_que que_est est_en,si_es_as es_as_esta as_esta_medalla esta_medalla_al medalla_al_dios al_dios_de dios_de_las de_las_piramides las_piramides_de piramides_de_egipto de_egipto_que egipto_que_est que_est_en
2019-08-19 17:25:08,100 realidades en beneficio de nuestra bella ciudad cuencaunida 👍97sobre100,100 realities for the benefit of our beautiful city of Cuenca 97 over 100,positivo,0.85,,100_realidades realidades_en en_beneficio beneficio_de de_nuestra nuestra_bella bella_ciudad ciudad_cuencaunida cuencaunida_97sobre100,100_realidades_en realidades_en_beneficio en_beneficio_de beneficio_de_nuestra de_nuestra_bella nuestra_bella_ciudad bella_ciudad_cuencaunida ciudad_cuencaunida_97sobre100
2019-08-19 17:24:48,los demás moradores no deberían permitir eso,the other inhabitants should not allow that,negativo,-0.125,Ecuador,los_dems dems_moradores moradores_no no_deberan deberan_permitir permitir_eso,los_dems_moradores dems_moradores_no moradores_no_deberan no_deberan_permitir deberan_permitir_eso
2019-08-19 17:24:28,97sobre100 por,97 over 100 per,neutral,0.0,Cuenca Ecuador,97sobre100_por,
2019-08-19 17:20:14,esperando que sigan asi buscando lo mejor para nuestra querida cuenca. aunque falta mucho aún por hacer. como es posible que solo un derecho para poner agua potable cueste 1150 aprox. y a parte mas de 300 por instalarla a 5mts. de la matriz...,hoping that they continue looking for the best for our beloved basin although there is still much to do as it is possible that only one right to put drinking water costs 1150 approx and more than 300 to install it 5mts from the matrix,positivo,0.4142857142857143,Cuenca Ecuador,esperando_que que_sigan sigan_asi asi_buscando buscando_lo lo_mejor mejor_para para_nuestra nuestra_querida querida_cuenca cuenca_aunque aunque_falta falta_mucho mucho_an an_por por_hacer hacer_como como_es es_posible posible_que que_solo solo_un un_derecho derecho_para para_poner poner_agua agua_potable potable_cueste cueste_1150 1150_aprox aprox_y y_a a_parte parte_mas mas_de de_300 300_por por_instalarla instalarla_a a_5mts 5mts_de de_la la_matriz,esperando_que_sigan que_sigan_asi sigan_asi_buscando asi_buscando_lo buscando_lo_mejor lo_mejor_para mejor_para_nuestra para_nuestra_querida nuestra_querida_cuenca querida_cuenca_aunque cuenca_aunque_falta aunque_falta_mucho falta_mucho_an mucho_an_por an_por_hacer por_hacer_como hacer_como_es como_es_posible es_posible_que posible_que_solo que_solo_un solo_un_derecho un_derecho_para derecho_para_poner para_poner_agua poner_agua_potable agua_potable_cueste potable_cueste_1150 cueste_1150_aprox 1150_aprox_y aprox_y_a y_a_parte a_parte_mas parte_mas_de mas_de_300 de_300_por 300_por_instalarla por_instalarla_a instalarla_a_5mts a_5mts_de 5mts_de_la de_la_matriz
2019-08-19 17:20:03,sector quinta chica alta... cuando???,fifth high girl sector when,positivo,0.16,Cuenca Ecuador,sector_quinta quinta_chica chica_alta alta_cuando,sector_quinta_chica quinta_chica_alta chica_alta_cuando
2019-08-19 17:19:08,buenos tardes estimado ingeniero. claro que si me permito informarle. 212 km. de mantenimiento en las calles de lastre (161 km) pavimento flexible (1416 km) veredas pavimento rígido (3 43 km.). en la anterior administración no recuerdo la cifra exacta de mantenimiento vial.,good afternoon dear engineer clear that if I allow myself to inform you 212 km of maintenance on ballast streets 161 km flexible pavement 1416 km sidewalks rigid pavement 3 43 km in the previous administration I do not remember the exact amount of road maintenance,positivo,0.22083333333333333,Cuenca Ecuador,buenos_tardes tardes_estimado estimado_ingeniero ingeniero_claro claro_que que_si si_me me_permito permito_informarle informarle_212 212_km km_de de_mantenimiento mantenimiento_en en_las las_calles calles_de de_lastre lastre_161 161_km km_pavimento pavimento_flexible flexible_1416 1416_km km_veredas veredas_pavimento pavimento_rgido rgido_3 3_43 43_km km_en en_la la_anterior anterior_administracin administracin_no no_recuerdo recuerdo_la la_cifra cifra_exacta exacta_de de_mantenimiento mantenimiento_vial,buenos_tardes_estimado tardes_estimado_ingeniero estimado_ingeniero_claro ingeniero_claro_que claro_que_si que_si_me si_me_permito me_permito_informarle permito_informarle_212 informarle_212_km 212_km_de km_de_mantenimiento de_mantenimiento_en mantenimiento_en_las en_las_calles las_calles_de calles_de_lastre de_lastre_161 lastre_161_km 161_km_pavimento km_pavimento_flexible pavimento_flexible_1416 flexible_1416_km 1416_km_veredas km_veredas_pavimento veredas_pavimento_rgido pavimento_rgido_3 rgido_3_43 3_43_km 43_km_en km_en_la en_la_anterior la_anterior_administracin anterior_administracin_no administracin_no_recuerdo no_recuerdo_la recuerdo_la_cifra la_cifra_exacta cifra_exacta_de exacta_de_mantenimiento de_mantenimiento_vial
2019-08-19 17:16:04,el alcalde manifiesta que "las principales necesidades en todas las parroquias rurales que hemos visitado son vialidad agua potable alcantarillado; se han firmado algunos convenios para mejor el estado de sus carreteras y ya se están ejecutando".,The mayor states that the main needs in all the rural parishes that we have visited are drinking water sewer roads some agreements have been signed to improve the state of their roads and they are already running,positivo,0.08333333333333333,Cuenca Ecuador,el_alcalde alcalde_manifiesta manifiesta_que que_las las_principales principales_necesidades necesidades_en en_todas todas_las las_parroquias parroquias_rurales rurales_que que_hemos hemos_visitado visitado_son son_vialidad vialidad_agua agua_potable potable_alcantarillado alcantarillado_se se_han han_firmado firmado_algunos algunos_convenios convenios_para para_mejor mejor_el el_estado estado_de de_sus sus_carreteras carreteras_y y_ya ya_se se_estn estn_ejecutando,el_alcalde_manifiesta alcalde_manifiesta_que manifiesta_que_las que_las_principales las_principales_necesidades principales_necesidades_en necesidades_en_todas en_todas_las todas_las_parroquias las_parroquias_rurales parroquias_rurales_que rurales_que_hemos que_hemos_visitado hemos_visitado_son visitado_son_vialidad son_vialidad_agua vialidad_agua_potable agua_potable_alcantarillado potable_alcantarillado_se alcantarillado_se_han se_han_firmado han_firmado_algunos firmado_algunos_convenios algunos_convenios_para convenios_para_mejor para_mejor_el mejor_el_estado el_estado_de estado_de_sus de_sus_carreteras sus_carreteras_y carreteras_y_ya y_ya_se ya_se_estn se_estn_ejecutando
2019-08-19 17:13:52,97 sobre 100 excelente gestión sr alcalde.,97 out of 100 excellent manager sr mayor,positivo,1.0,,97_sobre sobre_100 100_excelente excelente_gestin gestin_sr sr_alcalde,97_sobre_100 sobre_100_excelente 100_excelente_gestin excelente_gestin_sr gestin_sr_alcalde
2019-08-19 17:10:19,cien días cien realidades 97sobre100,one hundred and one hundred realities 97 over 100,neutral,0.0,,cien_das das_cien cien_realidades realidades_97sobre100,cien_das_cien das_cien_realidades cien_realidades_97sobre100
2019-08-19 17:10:00,en ciudadnoticias entrevista con el alcalde sobre los primeros 100 días de administración. siga la transmisión en vivo en facebook live,In CiudadNews interview with the mayor about the first 100 days of administration follow the live broadcast on facebook live,positivo,0.17424242424242423,Cuenca Ecuador,en_ciudadnoticias ciudadnoticias_entrevista entrevista_con con_el el_alcalde alcalde_sobre sobre_los los_primeros primeros_100 100_das das_de de_administracin administracin_siga siga_la la_transmisin transmisin_en en_vivo vivo_en en_facebook facebook_live,en_ciudadnoticias_entrevista ciudadnoticias_entrevista_con entrevista_con_el con_el_alcalde el_alcalde_sobre alcalde_sobre_los sobre_los_primeros los_primeros_100 primeros_100_das 100_das_de das_de_administracin de_administracin_siga administracin_siga_la siga_la_transmisin la_transmisin_en transmisin_en_vivo en_vivo_en vivo_en_facebook en_facebook_live
2019-08-19 17:05:17,señor contreras como ingeniero civil le digo que hacer 212 km en 100 días es imposible hacer 1 km ya es difícil 212 ni en 5 años. no se cuantos hizo pero ud trabajo con el también me parece de pronto se acuerda. no falte a su profesión,Mr Contreras as a civil engineer I tell you that to do 212 km in 100 days it is impossible to do 1 km it is already difficult 212 or in 5 years I do not know how many he did but you also work with me too suddenly I remember you do not miss your profession,negativo,-0.16666666666666663,,seor_contreras contreras_como como_ingeniero ingeniero_civil civil_le le_digo digo_que que_hacer hacer_212 212_km km_en en_100 100_das das_es es_imposible imposible_hacer hacer_1 1_km km_ya ya_es es_difcil difcil_212 212_ni ni_en en_5 5_aos aos_no no_se se_cuantos cuantos_hizo hizo_pero pero_ud ud_trabajo trabajo_con con_el el_tambin tambin_me me_parece parece_de de_pronto pronto_se se_acuerda acuerda_no no_falte falte_a a_su su_profesin,seor_contreras_como contreras_como_ingeniero como_ingeniero_civil ingeniero_civil_le civil_le_digo le_digo_que digo_que_hacer que_hacer_212 hacer_212_km 212_km_en km_en_100 en_100_das 100_das_es das_es_imposible es_imposible_hacer imposible_hacer_1 hacer_1_km 1_km_ya km_ya_es ya_es_difcil es_difcil_212 difcil_212_ni 212_ni_en ni_en_5 en_5_aos 5_aos_no aos_no_se no_se_cuantos se_cuantos_hizo cuantos_hizo_pero hizo_pero_ud pero_ud_trabajo ud_trabajo_con trabajo_con_el con_el_tambin el_tambin_me tambin_me_parece me_parece_de parece_de_pronto de_pronto_se pronto_se_acuerda se_acuerda_no acuerda_no_falte no_falte_a falte_a_su a_su_profesin
2019-08-19 16:57:28,97/100 acciones de bien hacer,97100 actions to do well,neutral,0.0,Cuenca Ecuador,97100_acciones acciones_de de_bien bien_hacer,97100_acciones_de acciones_de_bien de_bien_hacer
2019-08-19 16:49:15,97sobre100 desde el dia cero esta nueva administracion se puso la ciudad encima para sacarla adelante y lo esta haciendo. cuencaunida,97 on 100 from day zero this new administration put the city on top to get it going and is doing it in Cuenca,positivo,0.3181818181818182,,97sobre100_desde desde_el el_dia dia_cero cero_esta esta_nueva nueva_administracion administracion_se se_puso puso_la la_ciudad ciudad_encima encima_para para_sacarla sacarla_adelante adelante_y y_lo lo_esta esta_haciendo haciendo_cuencaunida,97sobre100_desde_el desde_el_dia el_dia_cero dia_cero_esta cero_esta_nueva esta_nueva_administracion nueva_administracion_se administracion_se_puso se_puso_la puso_la_ciudad la_ciudad_encima ciudad_encima_para encima_para_sacarla para_sacarla_adelante sacarla_adelante_y adelante_y_lo y_lo_esta lo_esta_haciendo esta_haciendo_cuencaunida
2019-08-19 16:46:31,97sobre100 cien días cien realidades.,97 over 100 one hundred and one hundred realities,neutral,0.0,Cuenca Ecuador,97sobre100_cien cien_das das_cien cien_realidades,97sobre100_cien_das cien_das_cien das_cien_realidades
2019-08-19 16:44:14,presencia de act en diferentes sectores de la ciudad.,presence of act in different sectors of the city,neutral,0.0,,presencia_de de_act act_en en_diferentes diferentes_sectores sectores_de de_la la_ciudad,presencia_de_act de_act_en act_en_diferentes en_diferentes_sectores diferentes_sectores_de sectores_de_la de_la_ciudad
2019-08-19 16:33:22,trabajos permanentes de mantenimiento vial bajo la gestión del alcalde para mejorar tu movilidad. 97sobre100,permanent road maintenance works under the management of the mayor to improve your mobility 97sobre100,neutral,0.0,Cuenca Ecuador,trabajos_permanentes permanentes_de de_mantenimiento mantenimiento_vial vial_bajo bajo_la la_gestin gestin_del del_alcalde alcalde_para para_mejorar mejorar_tu tu_movilidad movilidad_97sobre100,trabajos_permanentes_de permanentes_de_mantenimiento de_mantenimiento_vial mantenimiento_vial_bajo vial_bajo_la bajo_la_gestin la_gestin_del gestin_del_alcalde del_alcalde_para alcalde_para_mejorar para_mejorar_tu mejorar_tu_movilidad tu_movilidad_97sobre100
2019-08-19 16:33:07,97sobre100 el trabajo siempre de la mano con los cuencanos para una mejor cuenca,97sobre100 always work hand in hand with the basins for a better basin,positivo,0.5,Ecuador,97sobre100_el el_trabajo trabajo_siempre siempre_de de_la la_mano mano_con con_los los_cuencanos cuencanos_para para_una una_mejor mejor_cuenca,97sobre100_el_trabajo el_trabajo_siempre trabajo_siempre_de siempre_de_la de_la_mano la_mano_con mano_con_los con_los_cuencanos los_cuencanos_para cuencanos_para_una para_una_mejor una_mejor_cuenca
2019-08-19 16:32:33,un día a la vez juntos hacemos de una ciudad memorable. ¡felicitaciones por este gran progreso 97sobre100 cuencaunida,one day at a time together we make a memorable city congratulations on this great progress 97sobre100 cuencaunida,positivo,0.65,Cuenca Ecuador,un_da da_a a_la la_vez vez_juntos juntos_hacemos hacemos_de de_una una_ciudad ciudad_memorable memorable_felicitaciones felicitaciones_por por_este este_gran gran_progreso progreso_97sobre100 97sobre100_cuencaunida,un_da_a da_a_la a_la_vez la_vez_juntos vez_juntos_hacemos juntos_hacemos_de hacemos_de_una de_una_ciudad una_ciudad_memorable ciudad_memorable_felicitaciones memorable_felicitaciones_por felicitaciones_por_este por_este_gran este_gran_progreso gran_progreso_97sobre100 progreso_97sobre100_cuencaunida
2019-08-19 16:28:37,se convierte en una ciudad que planifica su futuro con obras que la harán aún más bella el trabajo da sus frutos cien días cien realidades. 97sobrecien,It becomes a city that plans its future with works that will make it even more beautiful the work bears fruit one hundred and one hundred realities,positivo,0.45,Cuenca  Ecuador,se_convierte convierte_en en_una una_ciudad ciudad_que que_planifica planifica_su su_futuro futuro_con con_obras obras_que que_la la_harn harn_an an_ms ms_bella bella_el el_trabajo trabajo_da da_sus sus_frutos frutos_cien cien_das das_cien cien_realidades realidades_97sobrecien,se_convierte_en convierte_en_una en_una_ciudad una_ciudad_que ciudad_que_planifica que_planifica_su planifica_su_futuro su_futuro_con futuro_con_obras con_obras_que obras_que_la que_la_harn la_harn_an harn_an_ms an_ms_bella ms_bella_el bella_el_trabajo el_trabajo_da trabajo_da_sus da_sus_frutos sus_frutos_cien frutos_cien_das cien_das_cien das_cien_realidades cien_realidades_97sobrecien
2019-08-19 16:25:24,la cuenta de un hombre público pierde interés cuando la utiliza más como medio de propaganda. volveré a seguir a cuando vuelva a ser una cuenta en la que se informe sobre temas relevantes para cuenca,The account of a public man loses interest when he uses it more as a means of propaganda to follow again when he becomes an account in which he reports on relevant issues for the basin,positivo,0.1,Cuenca Ecuador,la_cuenta cuenta_de de_un un_hombre hombre_pblico pblico_pierde pierde_inters inters_cuando cuando_la la_utiliza utiliza_ms ms_como como_medio medio_de de_propaganda propaganda_volver volver_a a_seguir seguir_a a_cuando cuando_vuelva vuelva_a a_ser ser_una una_cuenta cuenta_en en_la la_que que_se se_informe informe_sobre sobre_temas temas_relevantes relevantes_para para_cuenca,la_cuenta_de cuenta_de_un de_un_hombre un_hombre_pblico hombre_pblico_pierde pblico_pierde_inters pierde_inters_cuando inters_cuando_la cuando_la_utiliza la_utiliza_ms utiliza_ms_como ms_como_medio como_medio_de medio_de_propaganda de_propaganda_volver propaganda_volver_a volver_a_seguir a_seguir_a seguir_a_cuando a_cuando_vuelva cuando_vuelva_a vuelva_a_ser a_ser_una ser_una_cuenta una_cuenta_en cuenta_en_la en_la_que la_que_se que_se_informe se_informe_sobre informe_sobre_temas sobre_temas_relevantes temas_relevantes_para relevantes_para_cuenca
2019-08-19 16:24:14,más de 5.500 niños niñas y adolescentes han sido beneficiados hasta la fecha con las charlas de la campaña vacacionesmásseguras impulsada por el alcalde en beneficio de la seguridad de los más pequeños.,More than 5500 children and adolescents have benefited to date with the talks of the most secure holiday campaign promoted by the mayor for the benefit of the safety of the little ones,positivo,0.303125,Cuenca Ecuador,ms_de de_5500 5500_nios nios_nias nias_y y_adolescentes adolescentes_han han_sido sido_beneficiados beneficiados_hasta hasta_la la_fecha fecha_con con_las las_charlas charlas_de de_la la_campaa campaa_vacacionesmsseguras vacacionesmsseguras_impulsada impulsada_por por_el el_alcalde alcalde_en en_beneficio beneficio_de de_la la_seguridad seguridad_de de_los los_ms ms_pequeos,ms_de_5500 de_5500_nios 5500_nios_nias nios_nias_y nias_y_adolescentes y_adolescentes_han adolescentes_han_sido han_sido_beneficiados sido_beneficiados_hasta beneficiados_hasta_la hasta_la_fecha la_fecha_con fecha_con_las con_las_charlas las_charlas_de charlas_de_la de_la_campaa la_campaa_vacacionesmsseguras campaa_vacacionesmsseguras_impulsada vacacionesmsseguras_impulsada_por impulsada_por_el por_el_alcalde el_alcalde_en alcalde_en_beneficio en_beneficio_de beneficio_de_la de_la_seguridad la_seguridad_de seguridad_de_los de_los_ms los_ms_pequeos
2019-08-19 16:18:40,apoyo total 100 realidades en 100 días nos demuestra que cosas grandes están por venir cuencaunida 97sobre100,Total support 100 realities in 100 days shows us that great things are yet to come in Cuenca 97 over 100,positivo,0.4,,apoyo_total total_100 100_realidades realidades_en en_100 100_das das_nos nos_demuestra demuestra_que que_cosas cosas_grandes grandes_estn estn_por por_venir venir_cuencaunida cuencaunida_97sobre100,apoyo_total_100 total_100_realidades 100_realidades_en realidades_en_100 en_100_das 100_das_nos das_nos_demuestra nos_demuestra_que demuestra_que_cosas que_cosas_grandes cosas_grandes_estn grandes_estn_por estn_por_venir por_venir_cuencaunida venir_cuencaunida_97sobre100
2019-08-19 16:18:28,se ha dado un paso importante en la ciudad planificarla y ordenarla. 97sobre100,an important step has been taken in the city to plan and order it 97 over 100,positivo,0.4,CuencaEcuador ,se_ha ha_dado dado_un un_paso paso_importante importante_en en_la la_ciudad ciudad_planificarla planificarla_y y_ordenarla ordenarla_97sobre100,se_ha_dado ha_dado_un dado_un_paso un_paso_importante paso_importante_en importante_en_la en_la_ciudad la_ciudad_planificarla ciudad_planificarla_y planificarla_y_ordenarla y_ordenarla_97sobre100
2019-08-19 16:17:51,en los primeros días de gestión del alcalde se ha trabajado en 212 kilómetros de mantenimiento vial. 97sobre100,In the first days of management of the mayor work has been carried out on 212 kilometers of road maintenance 97 over 100,positivo,0.25,Cuenca Ecuador,en_los los_primeros primeros_das das_de de_gestin gestin_del del_alcalde alcalde_se se_ha ha_trabajado trabajado_en en_212 212_kilmetros kilmetros_de de_mantenimiento mantenimiento_vial vial_97sobre100,en_los_primeros los_primeros_das primeros_das_de das_de_gestin de_gestin_del gestin_del_alcalde del_alcalde_se alcalde_se_ha se_ha_trabajado ha_trabajado_en trabajado_en_212 en_212_kilmetros 212_kilmetros_de kilmetros_de_mantenimiento de_mantenimiento_vial mantenimiento_vial_97sobre100
2019-08-19 16:14:56,día a día es un progreso para lo importante es mantener esa visión buen trabajo 97sobre100,Day by day is a progress for what is important is to keep that vision good work 97 on 100,positivo,0.55,CuencaEcuador,da_a a_da da_es es_un un_progreso progreso_para para_lo lo_importante importante_es es_mantener mantener_esa esa_visin visin_buen buen_trabajo trabajo_97sobre100,da_a_da a_da_es da_es_un es_un_progreso un_progreso_para progreso_para_lo para_lo_importante lo_importante_es importante_es_mantener es_mantener_esa mantener_esa_visin esa_visin_buen visin_buen_trabajo buen_trabajo_97sobre100
2019-08-19 16:10:21,cuenca: comenzamos con este sueño el 15 de mayo del 2019 hoy ya tenemos 100 realidades entregadas a cuenca. iniciamos la cuenta progresiva desde hoy hasta llegar al día 100. 96sobre100,Cuenca We started with this dream on May 15 2019 Today we already have 100 realities delivered to Cuenca We start the progressive account from today until we reach 100 96 96,neutral,0.0,Cuenca Ecuador,cuenca_comenzamos comenzamos_con con_este este_sueo sueo_el el_15 15_de de_mayo mayo_del del_2019 2019_hoy hoy_ya ya_tenemos tenemos_100 100_realidades realidades_entregadas entregadas_a a_cuenca cuenca_iniciamos iniciamos_la la_cuenta cuenta_progresiva progresiva_desde desde_hoy hoy_hasta hasta_llegar llegar_al al_da da_100 100_96sobre100,cuenca_comenzamos_con comenzamos_con_este con_este_sueo este_sueo_el sueo_el_15 el_15_de 15_de_mayo de_mayo_del mayo_del_2019 del_2019_hoy 2019_hoy_ya hoy_ya_tenemos ya_tenemos_100 tenemos_100_realidades 100_realidades_entregadas realidades_entregadas_a entregadas_a_cuenca a_cuenca_iniciamos cuenca_iniciamos_la iniciamos_la_cuenta la_cuenta_progresiva cuenta_progresiva_desde progresiva_desde_hoy desde_hoy_hasta hoy_hasta_llegar hasta_llegar_al llegar_al_da al_da_100 da_100_96sobre100
2019-08-19 16:09:57,trabajamos para cumplir los compromisos con los cuencanos. son cien días cien realidades 👏👏 97sobre100,we work to fulfill the commitments with the basins are one hundred and one hundred realities 97 over 100,neutral,0.0,Ecuador,trabajamos_para para_cumplir cumplir_los los_compromisos compromisos_con con_los los_cuencanos cuencanos_son son_cien cien_das das_cien cien_realidades realidades_97sobre100,trabajamos_para_cumplir para_cumplir_los cumplir_los_compromisos los_compromisos_con compromisos_con_los con_los_cuencanos los_cuencanos_son cuencanos_son_cien son_cien_das cien_das_cien das_cien_realidades cien_realidades_97sobre100
2019-08-19 16:05:57,los trabajos que han realizado él alcalde junto a su equipo se ha visto reflejado en varios temas como la seguridad el transporte y el bienestar de la ciudadanía. hoy más que nunca vemos una cuencaunida,The work done by the mayor with his team has been reflected in several issues such as safety transportation and citizen welfare today more than ever we see a basin,positivo,0.16666666666666666,,los_trabajos trabajos_que que_han han_realizado realizado_l l_alcalde alcalde_junto junto_a a_su su_equipo equipo_se se_ha ha_visto visto_reflejado reflejado_en en_varios varios_temas temas_como como_la la_seguridad seguridad_el el_transporte transporte_y y_el el_bienestar bienestar_de de_la la_ciudadana ciudadana_hoy hoy_ms ms_que que_nunca nunca_vemos vemos_una una_cuencaunida,los_trabajos_que trabajos_que_han que_han_realizado han_realizado_l realizado_l_alcalde l_alcalde_junto alcalde_junto_a junto_a_su a_su_equipo su_equipo_se equipo_se_ha se_ha_visto ha_visto_reflejado visto_reflejado_en reflejado_en_varios en_varios_temas varios_temas_como temas_como_la como_la_seguridad la_seguridad_el seguridad_el_transporte el_transporte_y transporte_y_el y_el_bienestar el_bienestar_de bienestar_de_la de_la_ciudadana la_ciudadana_hoy ciudadana_hoy_ms hoy_ms_que ms_que_nunca que_nunca_vemos nunca_vemos_una vemos_una_cuencaunida
