creado,texto_es,texto_en,polaridad,valor_polaridad,ubicacion_usuario,terminos_2, terminos_3
2019-08-16 02:17:52,solucionesplayariñinahue en sector de ranquil y epulafquen se reunieron alcalde miguel meza dir. doh dir. regional de aguas y cap. de puerto. gestión de de crear la “mesa del borde costero del lago ranco” para resguardar el acceso público a playas 🤝,playariinahue solutions in the ranquil and epulafquen sector met mayor miguel meza dir doh dir regional of waters and cap de puerto gestin to create the table of the coastal edge of ranco lake to protect public access to beaches,neutral,0.0,Lago Ranco Chile,solucionesplayariinahue_en en_sector sector_de de_ranquil ranquil_y y_epulafquen epulafquen_se se_reunieron reunieron_alcalde alcalde_miguel miguel_meza meza_dir dir_doh doh_dir dir_regional regional_de de_aguas aguas_y y_cap cap_de de_puerto puerto_gestin gestin_de de_de de_crear crear_la la_mesa mesa_del del_borde borde_costero costero_del del_lago lago_ranco ranco_para para_resguardar resguardar_el el_acceso acceso_pblico pblico_a a_playas,solucionesplayariinahue_en_sector en_sector_de sector_de_ranquil de_ranquil_y ranquil_y_epulafquen y_epulafquen_se epulafquen_se_reunieron se_reunieron_alcalde reunieron_alcalde_miguel alcalde_miguel_meza miguel_meza_dir meza_dir_doh dir_doh_dir doh_dir_regional dir_regional_de regional_de_aguas de_aguas_y aguas_y_cap y_cap_de cap_de_puerto de_puerto_gestin puerto_gestin_de gestin_de_de de_de_crear de_crear_la crear_la_mesa la_mesa_del mesa_del_borde del_borde_costero borde_costero_del costero_del_lago del_lago_ranco lago_ranco_para ranco_para_resguardar para_resguardar_el resguardar_el_acceso el_acceso_pblico acceso_pblico_a pblico_a_playas
2019-08-16 01:54:50,al reinstalar la comisión de la baja de los ríos grijalva y carrizal le presentaron al alcalde propuestas para el rescate de la laguna “las ilusiones” la construcción de la planta potabilizadora carrizal 2 y el cambio de red de agua potable entre otras.,when reinstating the commission of the loss of the ros grijalva and carrizal they presented to the mayor proposals for the rescue of the lagoon the illusions the construction of the carrizal 2 water treatment plant and the change of drinking water network among others,neutral,0.0,,al_reinstalar reinstalar_la la_comisin comisin_de de_la la_baja baja_de de_los los_ros ros_grijalva grijalva_y y_carrizal carrizal_le le_presentaron presentaron_al al_alcalde alcalde_propuestas propuestas_para para_el el_rescate rescate_de de_la la_laguna laguna_las las_ilusiones ilusiones_la la_construccin construccin_de de_la la_planta planta_potabilizadora potabilizadora_carrizal carrizal_2 2_y y_el el_cambio cambio_de de_red red_de de_agua agua_potable potable_entre entre_otras,al_reinstalar_la reinstalar_la_comisin la_comisin_de comisin_de_la de_la_baja la_baja_de baja_de_los de_los_ros los_ros_grijalva ros_grijalva_y grijalva_y_carrizal y_carrizal_le carrizal_le_presentaron le_presentaron_al presentaron_al_alcalde al_alcalde_propuestas alcalde_propuestas_para propuestas_para_el para_el_rescate el_rescate_de rescate_de_la de_la_laguna la_laguna_las laguna_las_ilusiones las_ilusiones_la ilusiones_la_construccin la_construccin_de construccin_de_la de_la_planta la_planta_potabilizadora planta_potabilizadora_carrizal potabilizadora_carrizal_2 carrizal_2_y 2_y_el y_el_cambio el_cambio_de cambio_de_red de_red_de red_de_agua de_agua_potable agua_potable_entre potable_entre_otras
2019-08-15 23:12:39,reinstalan comisión de la baja de los ríos grijalva y carrizal *el alcalde evaristo hernández cruz destacó la importancia de invertir en proyectos que permitan dar solución a la problemática del agua que afecta al municipio,reinstatement commission of the loss of the ros grijalva and carrizal mayor evaristo hernndez cruz stressed the importance of investing in projects that allow to solve the water problem that affects the municipality,neutral,0.0,,reinstalan_comisin comisin_de de_la la_baja baja_de de_los los_ros ros_grijalva grijalva_y y_carrizal carrizal_el el_alcalde alcalde_evaristo evaristo_hernndez hernndez_cruz cruz_destac destac_la la_importancia importancia_de de_invertir invertir_en en_proyectos proyectos_que que_permitan permitan_dar dar_solucin solucin_a a_la la_problemtica problemtica_del del_agua agua_que que_afecta afecta_al al_municipio,reinstalan_comisin_de comisin_de_la de_la_baja la_baja_de baja_de_los de_los_ros los_ros_grijalva ros_grijalva_y grijalva_y_carrizal y_carrizal_el carrizal_el_alcalde el_alcalde_evaristo alcalde_evaristo_hernndez evaristo_hernndez_cruz hernndez_cruz_destac cruz_destac_la destac_la_importancia la_importancia_de importancia_de_invertir de_invertir_en invertir_en_proyectos en_proyectos_que proyectos_que_permitan que_permitan_dar permitan_dar_solucin dar_solucin_a solucin_a_la a_la_problemtica la_problemtica_del problemtica_del_agua del_agua_que agua_que_afecta que_afecta_al afecta_al_municipio
2019-08-15 19:10:17,el único alcalde que visitó todas las parroquias sabe de primera mano sus necesidades en territorio experimentará un gran cambio apoyamos la gestión de nuestro alcalde,The only mayor who visits all the parishes knows first hand their needs in territory to experience a great change we support the management of our mayor,positivo,0.35000000000000003,CuencaEcuador,el_nico nico_alcalde alcalde_que que_visit visit_todas todas_las las_parroquias parroquias_sabe sabe_de de_primera primera_mano mano_sus sus_necesidades necesidades_en en_territorio territorio_experimentar experimentar_un un_gran gran_cambio cambio_apoyamos apoyamos_la la_gestin gestin_de de_nuestro nuestro_alcalde,el_nico_alcalde nico_alcalde_que alcalde_que_visit que_visit_todas visit_todas_las todas_las_parroquias las_parroquias_sabe parroquias_sabe_de sabe_de_primera de_primera_mano primera_mano_sus mano_sus_necesidades sus_necesidades_en necesidades_en_territorio en_territorio_experimentar territorio_experimentar_un experimentar_un_gran un_gran_cambio gran_cambio_apoyamos cambio_apoyamos_la apoyamos_la_gestin la_gestin_de gestin_de_nuestro de_nuestro_alcalde
2019-08-15 18:41:56,hace falta mano dura para todos esos "vendedores ambulantes limpia vidrios y limosneros extrangeros" queremos la de siempre ordenada y segura. alcalde gobernador consejeros. trabajen,hard hand is needed for all those street vendors clean glass and foreign alms we want the always tidy and safe mayor governor councilors work,positivo,0.21000000000000002,Cuenca Ecuador,hace_falta falta_mano mano_dura dura_para para_todos todos_esos esos_vendedores vendedores_ambulantes ambulantes_limpia limpia_vidrios vidrios_y y_limosneros limosneros_extrangeros extrangeros_queremos queremos_la la_de de_siempre siempre_ordenada ordenada_y y_segura segura_alcalde alcalde_gobernador gobernador_consejeros consejeros_trabajen,hace_falta_mano falta_mano_dura mano_dura_para dura_para_todos para_todos_esos todos_esos_vendedores esos_vendedores_ambulantes vendedores_ambulantes_limpia ambulantes_limpia_vidrios limpia_vidrios_y vidrios_y_limosneros y_limosneros_extrangeros limosneros_extrangeros_queremos extrangeros_queremos_la queremos_la_de la_de_siempre de_siempre_ordenada siempre_ordenada_y ordenada_y_segura y_segura_alcalde segura_alcalde_gobernador alcalde_gobernador_consejeros gobernador_consejeros_trabajen
2019-08-15 17:47:56,ciudad | el alcalde de centro presidió la tercera sesión ordinaria de la comisión de la baja de los ríos grijalva y carrizal cuyo fin es conocer la situación que guardan los cuerpos de agua así como generar estrategias públicas para su limpieza.,The mayor of the city presided over the third ordinary session of the commission for the lowering of the Ros Grijalva and Carrizal whose purpose is to know the situation of the bodies of water as well as generate public strategies for cleaning,negativo,-0.08333333333333333,,ciudad_el el_alcalde alcalde_de de_centro centro_presidi presidi_la la_tercera tercera_sesin sesin_ordinaria ordinaria_de de_la la_comisin comisin_de de_la la_baja baja_de de_los los_ros ros_grijalva grijalva_y y_carrizal carrizal_cuyo cuyo_fin fin_es es_conocer conocer_la la_situacin situacin_que que_guardan guardan_los los_cuerpos cuerpos_de de_agua agua_as as_como como_generar generar_estrategias estrategias_pblicas pblicas_para para_su su_limpieza,ciudad_el_alcalde el_alcalde_de alcalde_de_centro de_centro_presidi centro_presidi_la presidi_la_tercera la_tercera_sesin tercera_sesin_ordinaria sesin_ordinaria_de ordinaria_de_la de_la_comisin la_comisin_de comisin_de_la de_la_baja la_baja_de baja_de_los de_los_ros los_ros_grijalva ros_grijalva_y grijalva_y_carrizal y_carrizal_cuyo carrizal_cuyo_fin cuyo_fin_es fin_es_conocer es_conocer_la conocer_la_situacin la_situacin_que situacin_que_guardan que_guardan_los guardan_los_cuerpos los_cuerpos_de cuerpos_de_agua de_agua_as agua_as_como as_como_generar como_generar_estrategias generar_estrategias_pblicas estrategias_pblicas_para pblicas_para_su para_su_limpieza
2019-08-15 17:26:25,preside el alcalde evaristo hernández cruz la tercera sesión ordinaria de la comisión de la baja de los ríos grijalva y carrizal cuyo fin es conocer la situación que guardan los cuerpos de agua así como generar estrategias públicas para su limpieza y conservación.,The Mayor Evaristo Hernndez Cruz presides over the third ordinary session of the commission of the lowering of the Ros Grijalva and Carrizal whose purpose is to know the situation that the bodies of water keep as well as generate public strategies for cleaning and conservation,negativo,-0.08333333333333333,Centro Tabasco,preside_el el_alcalde alcalde_evaristo evaristo_hernndez hernndez_cruz cruz_la la_tercera tercera_sesin sesin_ordinaria ordinaria_de de_la la_comisin comisin_de de_la la_baja baja_de de_los los_ros ros_grijalva grijalva_y y_carrizal carrizal_cuyo cuyo_fin fin_es es_conocer conocer_la la_situacin situacin_que que_guardan guardan_los los_cuerpos cuerpos_de de_agua agua_as as_como como_generar generar_estrategias estrategias_pblicas pblicas_para para_su su_limpieza limpieza_y y_conservacin,preside_el_alcalde el_alcalde_evaristo alcalde_evaristo_hernndez evaristo_hernndez_cruz hernndez_cruz_la cruz_la_tercera la_tercera_sesin tercera_sesin_ordinaria sesin_ordinaria_de ordinaria_de_la de_la_comisin la_comisin_de comisin_de_la de_la_baja la_baja_de baja_de_los de_los_ros los_ros_grijalva ros_grijalva_y grijalva_y_carrizal y_carrizal_cuyo carrizal_cuyo_fin cuyo_fin_es fin_es_conocer es_conocer_la conocer_la_situacin la_situacin_que situacin_que_guardan que_guardan_los guardan_los_cuerpos los_cuerpos_de cuerpos_de_agua de_agua_as agua_as_como as_como_generar como_generar_estrategias generar_estrategias_pblicas estrategias_pblicas_para pblicas_para_su para_su_limpieza su_limpieza_y limpieza_y_conservacin
2019-08-15 16:42:51,100 días como - el ing.  cumple sus primeros 100 días de administración. usted ¿cómo califica al nuevo alcalde?,100 days as ing meets his first 100 days of administration how do you rate the new mayor,positivo,0.19318181818181818,Cuenca Ecuador,100_das das_como como_el el_ing ing_cumple cumple_sus sus_primeros primeros_100 100_das das_de de_administracin administracin_usted usted_cmo cmo_califica califica_al al_nuevo nuevo_alcalde,100_das_como das_como_el como_el_ing el_ing_cumple ing_cumple_sus cumple_sus_primeros sus_primeros_100 primeros_100_das 100_das_de das_de_administracin de_administracin_usted administracin_usted_cmo usted_cmo_califica cmo_califica_al califica_al_nuevo al_nuevo_alcalde
2019-08-15 16:40:43,ciudad el alcalde de centro encabeza en estos momentos la tercera sesión ordinaria y reinstalacion de la comisión de la baja de los ríos grijalva y carrizal.,The mayor of the city is currently leading the third ordinary session and reinstatement of the lower commission of the Ros Grijalva and Carrizal,negativo,-0.08333333333333333,,ciudad_el el_alcalde alcalde_de de_centro centro_encabeza encabeza_en en_estos estos_momentos momentos_la la_tercera tercera_sesin sesin_ordinaria ordinaria_y y_reinstalacion reinstalacion_de de_la la_comisin comisin_de de_la la_baja baja_de de_los los_ros ros_grijalva grijalva_y y_carrizal,ciudad_el_alcalde el_alcalde_de alcalde_de_centro de_centro_encabeza centro_encabeza_en encabeza_en_estos en_estos_momentos estos_momentos_la momentos_la_tercera la_tercera_sesin tercera_sesin_ordinaria sesin_ordinaria_y ordinaria_y_reinstalacion y_reinstalacion_de reinstalacion_de_la de_la_comisin la_comisin_de comisin_de_la de_la_baja la_baja_de baja_de_los de_los_ros los_ros_grijalva ros_grijalva_y grijalva_y_carrizal
2019-08-15 14:01:05,señor alcalde una vía de ingreso digna por el sur de es indispensable. lo recordará,Mayor a dignified entry through the south is essential to remember,neutral,0.0,Cuenca Ecuador,seor_alcalde alcalde_una una_va va_de de_ingreso ingreso_digna digna_por por_el el_sur sur_de de_es es_indispensable indispensable_lo lo_recordar,seor_alcalde_una alcalde_una_va una_va_de va_de_ingreso de_ingreso_digna ingreso_digna_por digna_por_el por_el_sur el_sur_de sur_de_es de_es_indispensable es_indispensable_lo indispensable_lo_recordar
2019-08-15 03:31:04,nada de pus solo q como ciudadano puedo pedir cuentas que ha hecho el alcalde en estos 100 dias bueno faltan 10 mas espermos haga algo y no haya ineptitud lo otro de coimas robos dadivas veamos los temas de seguros como se resuelven en el municipio por el bien de,nothing of pus only that as a citizen I can ask for accounts that the mayor has done in these 100 days well there are 10 more we hope to do something and there is no ineptitude the other of theft robotic gifts lets see the insurance issues as they are resolved in the municipality for good of,positivo,0.195,Cuenca Ecuador,nada_de de_pus pus_solo solo_q q_como como_ciudadano ciudadano_puedo puedo_pedir pedir_cuentas cuentas_que que_ha ha_hecho hecho_el el_alcalde alcalde_en en_estos estos_100 100_dias dias_bueno bueno_faltan faltan_10 10_mas mas_espermos espermos_haga haga_algo algo_y y_no no_haya haya_ineptitud ineptitud_lo lo_otro otro_de de_coimas coimas_robos robos_dadivas dadivas_veamos veamos_los los_temas temas_de de_seguros seguros_como como_se se_resuelven resuelven_en en_el el_municipio municipio_por por_el el_bien bien_de,nada_de_pus de_pus_solo pus_solo_q solo_q_como q_como_ciudadano como_ciudadano_puedo ciudadano_puedo_pedir puedo_pedir_cuentas pedir_cuentas_que cuentas_que_ha que_ha_hecho ha_hecho_el hecho_el_alcalde el_alcalde_en alcalde_en_estos en_estos_100 estos_100_dias 100_dias_bueno dias_bueno_faltan bueno_faltan_10 faltan_10_mas 10_mas_espermos mas_espermos_haga espermos_haga_algo haga_algo_y algo_y_no y_no_haya no_haya_ineptitud haya_ineptitud_lo ineptitud_lo_otro lo_otro_de otro_de_coimas de_coimas_robos coimas_robos_dadivas robos_dadivas_veamos dadivas_veamos_los veamos_los_temas los_temas_de temas_de_seguros de_seguros_como seguros_como_se como_se_resuelven se_resuelven_en resuelven_en_el en_el_municipio el_municipio_por municipio_por_el por_el_bien el_bien_de
2019-08-15 00:07:10,la empresa municipal de aseo de es ejemplo para los gad las 510 toneladas de basura al día permiten generar 810 kw hora de energía eléctrica. alcalde pedro palacios agradeció el aporte del bde. 40años,The municipal cleaning company is an example for the gad the 510 tons of garbage per day allow 810 kW of electricity to be generated Mayor Pedro Palacios thanked the 40th year contribution,neutral,0.0,,la_empresa empresa_municipal municipal_de de_aseo aseo_de de_es es_ejemplo ejemplo_para para_los los_gad gad_las las_510 510_toneladas toneladas_de de_basura basura_al al_da da_permiten permiten_generar generar_810 810_kw kw_hora hora_de de_energa energa_elctrica elctrica_alcalde alcalde_pedro pedro_palacios palacios_agradeci agradeci_el el_aporte aporte_del del_bde bde_40aos,la_empresa_municipal empresa_municipal_de municipal_de_aseo de_aseo_de aseo_de_es de_es_ejemplo es_ejemplo_para ejemplo_para_los para_los_gad los_gad_las gad_las_510 las_510_toneladas 510_toneladas_de toneladas_de_basura de_basura_al basura_al_da al_da_permiten da_permiten_generar permiten_generar_810 generar_810_kw 810_kw_hora kw_hora_de hora_de_energa de_energa_elctrica energa_elctrica_alcalde elctrica_alcalde_pedro alcalde_pedro_palacios pedro_palacios_agradeci palacios_agradeci_el agradeci_el_aporte el_aporte_del aporte_del_bde del_bde_40aos
2019-08-14 23:11:26,la presente administración municipal asumió el compromiso de trabajar por el desarrollo de nuestra cuenca basada en la unidad y en el respeto. total apoyo sr. alcalde. 👍,The present municipal administration assumed the commitment to work for the development of our basin based on unity and full respect for the mayor,positivo,0.175,,la_presente presente_administracin administracin_municipal municipal_asumi asumi_el el_compromiso compromiso_de de_trabajar trabajar_por por_el el_desarrollo desarrollo_de de_nuestra nuestra_cuenca cuenca_basada basada_en en_la la_unidad unidad_y y_en en_el el_respeto respeto_total total_apoyo apoyo_sr sr_alcalde,la_presente_administracin presente_administracin_municipal administracin_municipal_asumi municipal_asumi_el asumi_el_compromiso el_compromiso_de compromiso_de_trabajar de_trabajar_por trabajar_por_el por_el_desarrollo el_desarrollo_de desarrollo_de_nuestra de_nuestra_cuenca nuestra_cuenca_basada cuenca_basada_en basada_en_la en_la_unidad la_unidad_y unidad_y_en y_en_el en_el_respeto el_respeto_total respeto_total_apoyo total_apoyo_sr apoyo_sr_alcalde
2019-08-14 23:01:11,la campaña vacacionesmásseguras se ejecuta bajo las directrices de y pdte. del csc con el objetivo de que niños niñas y adolescentes aprendan a disfrutar de su tiempo vacacional con mayor seguridad y fortalezcan su cultura de prevención.,The most safe holidays campaign is carried out under the guidelines of the csc and pdte with the aim that children and adolescents learn to enjoy their vacation time with greater security and strengthen their culture of prevention,positivo,0.475,Cuenca Ecuador,la_campaa campaa_vacacionesmsseguras vacacionesmsseguras_se se_ejecuta ejecuta_bajo bajo_las las_directrices directrices_de de_y y_pdte pdte_del del_csc csc_con con_el el_objetivo objetivo_de de_que que_nios nios_nias nias_y y_adolescentes adolescentes_aprendan aprendan_a a_disfrutar disfrutar_de de_su su_tiempo tiempo_vacacional vacacional_con con_mayor mayor_seguridad seguridad_y y_fortalezcan fortalezcan_su su_cultura cultura_de de_prevencin,la_campaa_vacacionesmsseguras campaa_vacacionesmsseguras_se vacacionesmsseguras_se_ejecuta se_ejecuta_bajo ejecuta_bajo_las bajo_las_directrices las_directrices_de directrices_de_y de_y_pdte y_pdte_del pdte_del_csc del_csc_con csc_con_el con_el_objetivo el_objetivo_de objetivo_de_que de_que_nios que_nios_nias nios_nias_y nias_y_adolescentes y_adolescentes_aprendan adolescentes_aprendan_a aprendan_a_disfrutar a_disfrutar_de disfrutar_de_su de_su_tiempo su_tiempo_vacacional tiempo_vacacional_con vacacional_con_mayor con_mayor_seguridad mayor_seguridad_y seguridad_y_fortalezcan y_fortalezcan_su fortalezcan_su_cultura su_cultura_de cultura_de_prevencin
2019-08-14 22:24:33,bien alcalde empezó el negocio de los abogados en gracias a su irresponsabilidad en sus ruedas de prensa .,the mayor started the business of lawyers thanks to his irresponsibility at his press conferences,positivo,0.2,,bien_alcalde alcalde_empez empez_el el_negocio negocio_de de_los los_abogados abogados_en en_gracias gracias_a a_su su_irresponsabilidad irresponsabilidad_en en_sus sus_ruedas ruedas_de de_prensa,bien_alcalde_empez alcalde_empez_el empez_el_negocio el_negocio_de negocio_de_los de_los_abogados los_abogados_en abogados_en_gracias en_gracias_a gracias_a_su a_su_irresponsabilidad su_irresponsabilidad_en irresponsabilidad_en_sus en_sus_ruedas sus_ruedas_de ruedas_de_prensa
2019-08-14 20:11:59,y el alcalde esta* ocupado en cobros x guardias de ambulantes.negocios fijos calle laura méndez de dolores guerrero autobuses hay discos artículo 30-v tránsito base culhuacan les dan taco canal alberca destruida hospital abandonó nomina familiar camellon,and the mayor is busy in charges x ambulant guards fixed businesses laura mndez de sorores guerrero street buses there are discs article 30v base transit culhuacan give them taco canal pool destroyed hospital abandon hospital payroll family camellon,negativo,-0.20000000000000004,,y_el el_alcalde alcalde_esta esta_ocupado ocupado_en en_cobros cobros_x x_guardias guardias_de de_ambulantesnegocios ambulantesnegocios_fijos fijos_calle calle_laura laura_mndez mndez_de de_dolores dolores_guerrero guerrero_autobuses autobuses_hay hay_discos discos_artculo artculo_30v 30v_trnsito trnsito_base base_culhuacan culhuacan_les les_dan dan_taco taco_canal canal_alberca alberca_destruida destruida_hospital hospital_abandon abandon_nomina nomina_familiar familiar_camellon,y_el_alcalde el_alcalde_esta alcalde_esta_ocupado esta_ocupado_en ocupado_en_cobros en_cobros_x cobros_x_guardias x_guardias_de guardias_de_ambulantesnegocios de_ambulantesnegocios_fijos ambulantesnegocios_fijos_calle fijos_calle_laura calle_laura_mndez laura_mndez_de mndez_de_dolores de_dolores_guerrero dolores_guerrero_autobuses guerrero_autobuses_hay autobuses_hay_discos hay_discos_artculo discos_artculo_30v artculo_30v_trnsito 30v_trnsito_base trnsito_base_culhuacan base_culhuacan_les culhuacan_les_dan les_dan_taco dan_taco_canal taco_canal_alberca canal_alberca_destruida alberca_destruida_hospital destruida_hospital_abandon hospital_abandon_nomina abandon_nomina_familiar nomina_familiar_camellon
2019-08-14 20:11:17,visitaseminariofutrono durante esta tarde en llifen el alcalde miguel meza y concejales erika rojas y cristina rosas participaron del seminario de turismo de la de ranco organizado por las cámaras de turismo de lagoranco y futrono para fomentar esta actividad juntos,During this afternoon the Mayor Miguel Miguel and Councilors Erika Roja and Cristina Rosa participated in the ranco tourism seminar organized by the Tourism Chambers of Lagoranco and Futrono to promote this activity together,neutral,0.0,Lago Ranco Chile,visitaseminariofutrono_durante durante_esta esta_tarde tarde_en en_llifen llifen_el el_alcalde alcalde_miguel miguel_meza meza_y y_concejales concejales_erika erika_rojas rojas_y y_cristina cristina_rosas rosas_participaron participaron_del del_seminario seminario_de de_turismo turismo_de de_la la_de de_ranco ranco_organizado organizado_por por_las las_cmaras cmaras_de de_turismo turismo_de de_lagoranco lagoranco_y y_futrono futrono_para para_fomentar fomentar_esta esta_actividad actividad_juntos,visitaseminariofutrono_durante_esta durante_esta_tarde esta_tarde_en tarde_en_llifen en_llifen_el llifen_el_alcalde el_alcalde_miguel alcalde_miguel_meza miguel_meza_y meza_y_concejales y_concejales_erika concejales_erika_rojas erika_rojas_y rojas_y_cristina y_cristina_rosas cristina_rosas_participaron rosas_participaron_del participaron_del_seminario del_seminario_de seminario_de_turismo de_turismo_de turismo_de_la de_la_de la_de_ranco de_ranco_organizado ranco_organizado_por organizado_por_las por_las_cmaras las_cmaras_de cmaras_de_turismo de_turismo_de turismo_de_lagoranco de_lagoranco_y lagoranco_y_futrono y_futrono_para futrono_para_fomentar para_fomentar_esta fomentar_esta_actividad esta_actividad_juntos
2019-08-14 20:00:05,[el personaje del día] mediados los años 70 esta cuadrilla “habló con el alcalde de burlada y le propusieron comenzar con una especie de academia de música. y el alcalde les dijo: ‘si queréis buzonear y si conseguís gente ya hablaremos’”,the character of the mid 70s this gang spoke with the mayor of mockery and proposed to start with a kind of music academy and the mayor told them if you want to buzonear and if you get people well talk,positivo,0.3,Pamplona Navarra,el_personaje personaje_del del_da da_mediados mediados_los los_aos aos_70 70_esta esta_cuadrilla cuadrilla_habl habl_con con_el el_alcalde alcalde_de de_burlada burlada_y y_le le_propusieron propusieron_comenzar comenzar_con con_una una_especie especie_de de_academia academia_de de_msica msica_y y_el el_alcalde alcalde_les les_dijo dijo_si si_queris queris_buzonear buzonear_y y_si si_consegus consegus_gente gente_ya ya_hablaremos,el_personaje_del personaje_del_da del_da_mediados da_mediados_los mediados_los_aos los_aos_70 aos_70_esta 70_esta_cuadrilla esta_cuadrilla_habl cuadrilla_habl_con habl_con_el con_el_alcalde el_alcalde_de alcalde_de_burlada de_burlada_y burlada_y_le y_le_propusieron le_propusieron_comenzar propusieron_comenzar_con comenzar_con_una con_una_especie una_especie_de especie_de_academia de_academia_de academia_de_msica de_msica_y msica_y_el y_el_alcalde el_alcalde_les alcalde_les_dijo les_dijo_si dijo_si_queris si_queris_buzonear queris_buzonear_y buzonear_y_si y_si_consegus si_consegus_gente consegus_gente_ya gente_ya_hablaremos
